AICTE ID,NAME,PROGRAMME,UNIVERSITY,LEVEL OF COURSE,COURSE,INTAKE,ADDRESS,ZONE,CITY,DISTRICT,STATE,INSTITUTE TYPE,,
1-36482807768,CENTRAL UNIVERSITY OF RAJASTHAN,MANAGEMENT,NOT APPLICABLE,POST GRADUATE,MBA,60,CITY ROAD KISHANGARH,JAIPUR,JAIPUR,AJMER,RAJASTHAN,CENTRAL UNIVERSITY,,
1-36473492246,AIMS IBS BUSINESS SCHOOL (ACLIV INSTITUTE OF MANAGEMENT STUDIES INTERNATIONAL BUSINESS SCHOOL),MANAGEMENT,"BANGALORE UNIVERSITY, BENGALURU",POST GRADUATE,MBA,180,"NO.235/E1, BOMMASANDRA INDUSTRIAL AREA, 3RD PHASE, BENGALURU - 560099",,BANGALORE,BANGALORE URBAN,KARNATAKA,PRIVATE-SELF FINANCING,,
1-36483566545,JAGAN INSTITUTE OF MANAGEMENT STUDIES,MANAGEMENT,NOT APPLICABLE,POST GRADUATE DIPLOMA,PGDM,90,"IP 2&3, PHASE-IV, SITAPURA INDUSTRIAL AREA, JAIPUR302 022",AJMER,AJMER,JAIPUR,RAJASTHAN,PRIVATE-SELF FINANCING,,
1-36473859279,MATS INSTITUTE OF MANAGEMENT & ENTREPRENURSHIP,MANAGEMENT,NOT APPLICABLE,POST GRADUATE DIPLOMA,PGDM(INTERNATIONAL BUSINESS),120,"JAKKASANDR POST, KANAKAPURA TALUK, RAMANAGARA DISTRICT - 562112 KARNATAKA",,RAMANAGARA,RAMANAGARA,KARNATAKA,PRIVATE-SELF FINANCING,,
1-36484130339,MAHARISHI ARVIND INTERNATIONAL INSTITUTE OF TECHNOLOGY,MANAGEMENT,"RAJASTHAN TECHNICAL UNIVERSITY, KOTA",POST GRADUATE,MBA,60,"IPA-1, RIICO INSTITUTIONAL AREA JHALAWAR ROAD RANPUR KOTA-325003 RAJASTHAN",JAIPUR,JAIPUR,KOTA,RAJASTHAN,PRIVATE-SELF FINANCING,,
1-36472870723,"YUVARAJA'S COLLEGE (AUTONOMOUS), UNIVERSITY OF MYSORE",MANAGEMENT,NOT APPLICABLE,POST GRADUATE,MBA,60,"JLB ROAD, MYSORE",,MYSORE,MYSORE,KARNATAKA,STATE GOVERNMENT UNIVERSITY,,
1-36486126953,KAUTILYA INSTITUTE OF TECHNOLOGY & ENGINEERING,MANAGEMENT,"RAJASTHAN TECHNICAL UNIVERSITY, KOTA",POST GRADUATE,MBA(BUSINESS MANAGEMENT),60,"ISI-16, RIICO INSTITUTIONAL AREA, SITAPURA, JAIPUR",KOTA,KOTA,JAIPUR,RAJASTHAN,PRIVATE-SELF FINANCING,,
1-36472214395,CHRIST DEEMED TO BE UNIVERSITY BANNERGHATTA ROAD CAMPUS,MANAGEMENT,NOT APPLICABLE,POST GRADUATE,MBA,60,"HULIMAVU, BANNERGHATTA ROAD",,BANGALORE,BANGALORE URBAN,KARNATAKA,DEEMED TO BE UNIVERSITY(PVT),,
1-36486731262,CHANDRAVATI EDUCATIONAL CHARITABLE TRUST GROUP OF INSTITUTIONS,MANAGEMENT,"RAJASTHAN TECHNICAL UNIVERSITY, KOTA",POST GRADUATE,MBA,30,"NH-11,OPP. GHANA NATIONAL PARK BHARATPUR - 321001(RAJASTHAN)",JAIPUR,JAIPUR,BHARATPUR,RAJASTHAN,PRIVATE-SELF FINANCING,,
1-36472759567,REGIONAL COLLEGE OF MANAGEMENT BANGALORE,MANAGEMENT,BENGALURU NORTH UNIVERSITY,POST GRADUATE,MBA,180,"SURVEY NO-34/4, 34/5, MUDUGURKI, DEVANAHALLI, BANGALORE- 562110",,BANGALORE,BANGALORE RURAL,KARNATAKA,PRIVATE-SELF FINANCING,,
1-36472759567,REGIONAL COLLEGE OF MANAGEMENT BANGALORE,MANAGEMENT,BENGALURU NORTH UNIVERSITY,POST GRADUATE,MBA(GENERAL MANAGEMENT),60,"SURVEY NO-34/4, 34/5, MUDUGURKI, DEVANAHALLI, BANGALORE- 562110",,BANGALORE,BANGALORE RURAL,KARNATAKA,PRIVATE-SELF FINANCING,,
1-36492105602,SHRINATHJI INSTITUTE OF TECHNOLOGY & ENGINEERING,MANAGEMENT,"RAJASTHAN TECHNICAL UNIVERSITY, KOTA",POST GRADUATE,MBA,60,"UPALI ODEN, NATHDWARA DIST- RAJSAMAND (RAJASTHAN)",BHARATPUR,BHARATPUR,RAJSAMAND,RAJASTHAN,PRIVATE-SELF FINANCING,,
1-36473965987,INTERNATIONAL SCHOOL OF BUSINESS & MEDIA,MANAGEMENT,NOT APPLICABLE,POST GRADUATE DIPLOMA,PGDM(FINANCIAL MANAGEMENT),30,"SURVEY NO.241, SOMPURA INDUSTRIAL AREA, NIDUVANDA VILLAGE, NELAMANGALA TALUK,",,NELAMANGALA,BANGALORE RURAL,KARNATAKA,PRIVATE-SELF FINANCING,,
1-36473965987,INTERNATIONAL SCHOOL OF BUSINESS & MEDIA,MANAGEMENT,NOT APPLICABLE,POST GRADUATE DIPLOMA,PGDM(HUMAN RESOURCE MANAGEMENT),30,"SURVEY NO.241, SOMPURA INDUSTRIAL AREA, NIDUVANDA VILLAGE, NELAMANGALA TALUK,",,NELAMANGALA,BANGALORE RURAL,KARNATAKA,PRIVATE-SELF FINANCING,,
1-36473965987,INTERNATIONAL SCHOOL OF BUSINESS & MEDIA,MANAGEMENT,NOT APPLICABLE,POST GRADUATE DIPLOMA,PGDM(MARKETING),30,"SURVEY NO.241, SOMPURA INDUSTRIAL AREA, NIDUVANDA VILLAGE, NELAMANGALA TALUK,",,NELAMANGALA,BANGALORE RURAL,KARNATAKA,PRIVATE-SELF FINANCING,,
1-36493722503,"SWAMI KESHVANAND INSTITUTE OF TECHNOLOGY, MANAGEMENT & GRAMOTHAN",MANAGEMENT,"RAJASTHAN TECHNICAL UNIVERSITY, KOTA",POST GRADUATE,MBA,60,"RAMNAGARIA, JAGATPURA,",UDAIPUR,RAJSAMAND,JAIPUR,RAJASTHAN,PRIVATE-SELF FINANCING,,
1-36475142298,CITY COLLEGE,MANAGEMENT,"BANGALORE UNIVERSITY, BENGALURU",POST GRADUATE,MBA,240,"#27/2, 33RD CROSS, 2ND MAIN 7TH BLOCK JAYANAGAR BANGALORE 560070",,BANGALORE,BANGALORE URBAN,KARNATAKA,PRIVATE-SELF FINANCING,,
1-36527281651,"ENGINEERING COLLEGE,AJMER",MANAGEMENT,"BIKANER TECHNICAL UNIVERSITY, BIKANER",POST GRADUATE,MBA,60,JAIPUR BEAWER HIGHWAY NH-8 BARLIYA CIRCLE,JAIPUR,JAIPUR,AJMER,RAJASTHAN,GOVERNMENT,,
1-36528099136,NIMT INSTITUTE OF MANAGEMENT,MANAGEMENT,NOT APPLICABLE,POST GRADUATE DIPLOMA,PGDM,60,"RIICO INDUSTRIAL AREA, SP-3, I, KESHWANA, KOTPUTLI JAIPUR ? 303001 RAJASTHAN.",AJMER,AJMER,JAIPUR,RAJASTHAN,PRIVATE-SELF FINANCING,,
1-36474309251,ADITYA INSTITUTE OF MANAGEMENT STUDIES AND RESEARCH,MANAGEMENT,BANGALORE CENTRAL UNIVERSITY,POST GRADUATE,MBA,120,"SURVEY NO.12, KOGILU MAIN ROAD, YELAHANKA",,BANGALORE,BANGALORE URBAN,KARNATAKA,PRIVATE-SELF FINANCING,,
1-36532904663,SHIV CHARAN MATHUR INSTITUTE OF MANAGEMENT & TECHNOLOGY,MANAGEMENT,"RAJASTHAN TECHNICAL UNIVERSITY, KOTA",POST GRADUATE,MBA,54,"PATHIK NAGAR, BHILWARA",JAIPUR,JAIPUR,BHILWARA,RAJASTHAN,PRIVATE-SELF FINANCING,,
1-36533542228,"SHEKHAWATI ENGINEERING COLLEGE, DUNDLOD",MANAGEMENT,"BIKANER TECHNICAL UNIVERSITY, BIKANER",POST GRADUATE,MBA,30,"NEAR DUNDLOD RAILWAY PHATAK, P.O. DUNDLOD, TEHSIL-NAWALGARH, DISTRICT-JHUNJHUNU , PIN-333 702 RAJASTHAN",BHILWARA,BHILWARA,JHUNJHUNU,RAJASTHAN,PRIVATE-SELF FINANCING,,
1-36474147973,SHRI MADHWA VADIRAJA INSTITUTE OF TECHNOLOGY AND MANAGEMENT,MANAGEMENT,"VISVESVARAYA?TECHNOLOGICAL UNIVERSITY, BELGAUM",POST GRADUATE,MBA (BUSINESS ANALYTICS),60,"VISHWOTHAMA NAGAR, BANTAKAL",,BANTAKAL,UDUPI,KARNATAKA,PRIVATE-SELF FINANCING,,
1-36533954548,APEX INSTITUTE OF MANAGEMENT & SCIENCE,MANAGEMENT,"APEX UNIVERSITY, JAIPUR",POST GRADUATE,MBA,120,"V.T.ROAD, MAN SAROVAR",JHUNJHUNU,JHUNJHUNU,JAIPUR,RAJASTHAN,PRIVATE-SELF FINANCING,,
1-36213709612,DON BOSCO INSTITUTE OF MANAGEMENT STUDIES AND COMPUTER APPLICATIONS,MANAGEMENT,"BANGALORE UNIVERSITY, BENGALURU",POST GRADUATE,MBA,120,"SURVEY NO. 8/7, KUMBALAGODU POST, KUMBALAGODU, BANGALORE 74",SOUTH-WEST,BANGALORE,BANGALORE URBAN,KARNATAKA,PRIVATE-SELF FINANCING,,
1-36534142605,KEYSTONE GROUP OF INSTITUTIONS,MANAGEMENT,"BIKANER TECHNICAL UNIVERSITY, BIKANER",POST GRADUATE,MBA,30,"169 KM MILESTONE, VILLAGE PILLOD LOHARU-CHIRAWA-JHUNJHUNU STATE HIGHWAY",JAIPUR,JAIPUR,JHUNJHUNU,RAJASTHAN,PRIVATE-SELF FINANCING,,
1-36215742895,CHRIST DEEMED TO BE UNIVERSITY MAIN CAMPUS,MANAGEMENT,NOT APPLICABLE,POST GRADUATE,MBA,600,HOSUR ROAD BENGALURU,SOUTH-EAST,BANGALORE,BANGALORE URBAN,KARNATAKA,DEEMED TO BE UNIVERSITY(PVT),,
1-36215742895,CHRIST DEEMED TO BE UNIVERSITY MAIN CAMPUS,MANAGEMENT,NOT APPLICABLE,POST GRADUATE,MBA (EXECUTIVE),60,HOSUR ROAD BENGALURU,SOUTH-EAST,BANGALORE,BANGALORE URBAN,KARNATAKA,DEEMED TO BE UNIVERSITY(PVT),,
1-36536821962,"INSTITUTE OF MANAGEMENT STUDIES, S.B.J.S. RAMPURIA JAIN COLLEGE",MANAGEMENT,"BIKANER TECHNICAL UNIVERSITY, BIKANER",POST GRADUATE,MBA,60,"J.N. VYAS COLONY CIRCLE, BIKANER (RAJASTHAN) 334003",JHUNJHUNU,JHUNJHUNU,BIKANER,RAJASTHAN,PRIVATE-SELF FINANCING,,
1-36213480459,ALLUM KARIBASAPPA INSTITUTE OF MANAGEMENT,MANAGEMENT,VIJAYANAGARA SRI KRISHNADEVARAYA UNIVERSITY BALLARI,POST GRADUATE,MBA,60,"V.V SANGHA'S VIJAYANAGAR INSTITUTE OF MANAGEMENT, V.S. CAMPUS, AIRPORT ROAD, CANTONMENT, BELLARY-583104",,BELLARY,BELLARY,KARNATAKA,PRIVATE-SELF FINANCING,,
1-36537406015,ARYABHATT COLLEGE OF MANAGEMENT,MANAGEMENT,"BIKANER TECHNICAL UNIVERSITY, BIKANER",POST GRADUATE,MBA,60,ARYABHATT COLLEGE OF MANAGEMENT BEHIND MAHILA MANDAL CHACHIAWAS -AJMER,BIKANER,BIKANER,AJMER,RAJASTHAN,PRIVATE-SELF FINANCING,,
1-36211227448,JYOTI NIVAS COLLEGE (MBA),MANAGEMENT,"BANGALORE UNIVERSITY, BENGALURU",POST GRADUATE,MBA,60,"HOSUR ROAD, BANGALORE",SOUTH-EAST,BANGALORE,BANGALORE URBAN,KARNATAKA,PRIVATE-SELF FINANCING,,
1-36539912934,SHANKARA INTERNATIONAL SCHOOL OF MANAGEMENT,MANAGEMENT,NOT APPLICABLE,POST GRADUATE DIPLOMA,PGDM,60,SP-44 (EXT.) RICCO INDUSTRIAL AREA KUKAS,AJMER,AJMER,JAIPUR,RAJASTHAN,PRIVATE-SELF FINANCING,,
1-36211608506,MOUNT CARMEL COLLEGE,MANAGEMENT,BENGALURU CENTRAL UNIVERSITY,POST GRADUATE,MASTERS OF BUSINESS ADMINISTRATION,60,"NO.58, PALACE ROAD, VASANTHNAGAR",CENTRAL,BANGALORE,BANGALORE URBAN,KARNATAKA,PRIVATE-SELF FINANCING,,
1-36541309894,G D MEMORIAL COLLEGE OF MANAGEMENT & TECHNOLOGY,MANAGEMENT,"BIKANER TECHNICAL UNIVERSITY, BIKANER",POST GRADUATE,MBA,60,"SECTOR-4, KURI BHAGTASANI HOUSING BOARD",JODHPUR,JODHPUR,JODHPUR,RAJASTHAN,PRIVATE-SELF FINANCING,,
1-36243322711,REGIONAL COLLEGE OF MANAGEMENT AND ENTREPRENEURSHIP,MANAGEMENT,NOT APPLICABLE,POST GRADUATE DIPLOMA,PGDM,120,"SURVEY NO 34/4, MUDUGURKI, VENKATAGIRI KOTE",NORTH-EAST,BANGALORE,BANGALORE RURAL,KARNATAKA,PRIVATE-SELF FINANCING,,
1-36543186548,JAIPURIA INSTITUTE OF MANAGEMENT,MANAGEMENT,NONE,FELLOWSHIP,FELLOW PROGRAM IN MANAGEMENT,10,"1, BAMBALA INSTITUTIONAL AREA, PRATAP NAGR, SANGANER, JAIPUR",JAIPUR,JAIPUR,JAIPUR,RAJASTHAN,PRIVATE-SELF FINANCING,,
1-36543186548,JAIPURIA INSTITUTE OF MANAGEMENT,MANAGEMENT,NOT APPLICABLE,POST GRADUATE DIPLOMA,PGDM,240,"1, BAMBALA INSTITUTIONAL AREA, PRATAP NAGR, SANGANER, JAIPUR",JAIPUR,JAIPUR,JAIPUR,RAJASTHAN,PRIVATE-SELF FINANCING,,
1-36543186548,JAIPURIA INSTITUTE OF MANAGEMENT,MANAGEMENT,NOT APPLICABLE,POST GRADUATE DIPLOMA,PGDM(SERVICE MANAGEMENT),60,"1, BAMBALA INSTITUTIONAL AREA, PRATAP NAGR, SANGANER, JAIPUR",JAIPUR,JAIPUR,JAIPUR,RAJASTHAN,PRIVATE-SELF FINANCING,,
1-36243916804,ST XAVIERS COLLEGE,MANAGEMENT,NOT APPLICABLE,POST GRADUATE DIPLOMA,PGDM,120,ST. XAVIER`S COLLEGE NO. 15 IAT QUEENS ROAD VASANTH NAGAR BANGALORE KARNATAKA 560051,CENTRAL,BANGALORE,BANGALORE URBAN,KARNATAKA,PRIVATE-SELF FINANCING,,
1-36243616750,PATEL INSTITUTE OF MANAGEMENT STUDIES,MANAGEMENT,NOT APPLICABLE,POST GRADUATE DIPLOMA,POST GRADUATE DIPLOMA IN MANAGEMENT,60,"25/2, BEHIND SAKRA WORLD HOSPITAL , KARIYAMMANA AGRAHARA, BELLNDUR POST",EAST,BANGALORE,BANGALORE URBAN,KARNATAKA,PRIVATE-SELF FINANCING,,
1-36545437810,VISION SCHOOL OF MANAGEMENT,MANAGEMENT,"RAJASTHAN TECHNICAL UNIVERSITY, KOTA",POST GRADUATE,MBA,60,"VISION SCHOOL OF MANAGEMENT BOJUNDA, UDAIPUR ROAD CHITTORGARH (RAJ) 312001",KOTA,CHITTORGARH,CHITTORGARH,RAJASTHAN,PRIVATE-SELF FINANCING,,
1-36243375153,INTERNATIONAL INSTITUTE OF BUSINESS STUDY,MANAGEMENT,NOT APPLICABLE,POST GRADUATE DIPLOMA,PGDM,180,"SURVEY NO. 75, MUTTUGADAHALLI, JALA HOBLI, BANGALORE NORTH TALUK, BANGALORE URBAN DISTRICT",NORTH,BANGALORE,BANGALORE URBAN,KARNATAKA,PRIVATE-SELF FINANCING,,
1-36243375153,INTERNATIONAL INSTITUTE OF BUSINESS STUDY,MANAGEMENT,NOT APPLICABLE,POST GRADUATE DIPLOMA,PGDM (MANAGEMENT),180,"SURVEY NO. 75, MUTTUGADAHALLI, JALA HOBLI, BANGALORE NORTH TALUK, BANGALORE URBAN DISTRICT",NORTH,BANGALORE,BANGALORE URBAN,KARNATAKA,PRIVATE-SELF FINANCING,,
1-36546016535,"IILM ACADEMY OF HIGHER LEARNING, JAIPUR CAMPUS",MANAGEMENT,NOT APPLICABLE,POST GRADUATE DIPLOMA,PGDM,60,"35/95, KUMBHA MARG, R.H.B.COLONY, PRATAP NAGAR, SECTOR 10, SANGANER, JAIPUR - 302033. RAJASTHAN.",JAIPUR,JAIPUR,JAIPUR,RAJASTHAN,PRIVATE-SELF FINANCING,,
1-36243428965,ISBR COLLEGE,MANAGEMENT,"BANGALORE UNIVERSITY, BENGALURU",POST GRADUATE,MBA(GENERAL MANAGEMENT),120,"16 ELECTRONIC CITY PHASE 1, HOSUR ROAD, BANGALORE-560100",SOUTH-EAST,BANGALORE,BANGALORE URBAN,KARNATAKA,PRIVATE-SELF FINANCING,,
1-36546690743,SHANKARA INTERNATIONAL SCHOOL OF MANAGEMENT AND RESEARCH,MANAGEMENT,"RAJASTHAN TECHNICAL UNIVERSITY, KOTA",POST GRADUATE,MBA,60,SP-41-C RICCO INDUSTRIAL AREA KUKAS,JAIPUR,JAIPUR,JAIPUR,RAJASTHAN,PRIVATE-SELF FINANCING,,
1-36547973402,SHRI AATM VALLABH JAIN KANYA MAHAVIDYALYA,MANAGEMENT,"BIKANER TECHNICAL UNIVERSITY, BIKANER",POST GRADUATE,MBA,120,"SUDAMA NAGAR, HANUMANGARH ROAD, SRI GANGANAGAR, RAJASTHAN 335001",GANGANAGAR,GANGANAGAR,GANGANAGAR,RAJASTHAN,PRIVATE-SELF FINANCING,,
1-36478980782,PRESIDENCY COLLEGE,MANAGEMENT,"BANGALORE UNIVERSITY, BENGALURU",POST GRADUATE,MBA,360,"NO.33/2C, 33/2D, KEMPAPURA, HEBBAL, BANGALORE",,BANGALORE,BANGALORE RURAL,KARNATAKA,PRIVATE-SELF FINANCING,,
1-36588553006,MAHARISHI ARVIND SCHOOL OF MANAGEMENT STUDIES,MANAGEMENT,"RAJASTHAN TECHNICAL UNIVERSITY, KOTA",POST GRADUATE,MBA,120,SECTOR-2 KAVERI PATH MANSAROVAR JAIPUR - 302 020 RAJASTHAN,JAIPUR,JAIPUR,JAIPUR,RAJASTHAN,PRIVATE-SELF FINANCING,,
1-36480306404,ISBR BUSINESS SCHOOL,MANAGEMENT,AICTE,FELLOWSHIP,FELLOW PROGRAM IN MANAGEMENT,20,"PLOT NO. 107, ELECTRONIC CITY - PHASE I, HOSUR ROAD",,BANGALORE,BANGALORE URBAN,KARNATAKA,PRIVATE-SELF FINANCING,,
1-36480306404,ISBR BUSINESS SCHOOL,MANAGEMENT,NOT APPLICABLE,POST GRADUATE DIPLOMA,PGDM,300,"PLOT NO. 107, ELECTRONIC CITY - PHASE I, HOSUR ROAD",,BANGALORE,BANGALORE URBAN,KARNATAKA,PRIVATE-SELF FINANCING,,
1-36480306404,ISBR BUSINESS SCHOOL,MANAGEMENT,AICTE,POST GRADUATE,PGDM,600,"PLOT NO. 107, ELECTRONIC CITY - PHASE I, HOSUR ROAD",,BANGALORE,BANGALORE URBAN,KARNATAKA,PRIVATE-SELF FINANCING,,
1-36480306404,ISBR BUSINESS SCHOOL,MANAGEMENT,NOT APPLICABLE,POST GRADUATE DIPLOMA,PGDM(GENERAL),240,"PLOT NO. 107, ELECTRONIC CITY - PHASE I, HOSUR ROAD",,BANGALORE,BANGALORE URBAN,KARNATAKA,PRIVATE-SELF FINANCING,,
1-36593735369,COMPUCOM INTITUTE OF TECH. & MANAGEMENT,MANAGEMENT,"RAJASTHAN TECHNICAL UNIVERSITY, KOTA",POST GRADUATE,MBA,60,"SP-3,5,5A, EPIP, RIICO INDUSTRIAL AREA, SITAPURA, JAIPUR (RAJASTHAN)-302022",JAIPUR,JAIPUR,JAIPUR,RAJASTHAN,PRIVATE-SELF FINANCING,,
1-36480700979,ST.GEORGE COLLEGE OF MANAGEMENT & SCIENCE,MANAGEMENT,BENGALURU NORTH UNIVERSITY,POST GRADUATE,MBA,120,"OMBR LAYOUT, BANASWADI, BANGALORE - 560 043",,BANGALORE,BANGALORE URBAN,KARNATAKA,PRIVATE-SELF FINANCING,,
1-36595308853,SHEKHAWATI INSTITUTE OF TECHNOLOGY,MANAGEMENT,"BIKANER TECHNICAL UNIVERSITY, BIKANER",POST GRADUATE,MBA,60,BEHIND CIRCUIT HOUSE SIKAR,JHUNJHUNU,SIKAR,SIKAR,RAJASTHAN,PRIVATE-SELF FINANCING,,
1-36480487658,THE OXFORD COLLEGE OF BUSINESS MANAGEMENT,MANAGEMENT,"BANGALORE UNIVERSITY, BENGALURU",POST GRADUATE,MBA,180,"NO 32, 19TH MAIN,17TH B CROSS SECTOR 4 HSR LAYOUT BANGALORE-560102",,BANGALORE,BANGALORE URBAN,KARNATAKA,PRIVATE-SELF FINANCING,,
1-36595406405,BIYANI INSTITUTE OF SCIENCE & MANAGEMENT,MANAGEMENT,"RAJASTHAN TECHNICAL UNIVERSITY, KOTA",POST GRADUATE,MBA,108,R-4 SECTOR 3 VIDHYADHAR NAGAR,JAIPUR,JAIPUR,JAIPUR,RAJASTHAN,PRIVATE-SELF FINANCING,,
1-36478105892,INDIAN INSTITUTE OF PLANTATION MANAGEMENT,MANAGEMENT,NONE,FELLOWSHIP,AGRIBUSINESS AND PLANTATION MANAGEMENT,10,JNANA BHARATHI CAMPUS P.O. MALATHALLI BANGALORE 560 056,,BANGALORE,BANGALORE URBAN,KARNATAKA,GOVERNMENT,,
1-36478105892,INDIAN INSTITUTE OF PLANTATION MANAGEMENT,MANAGEMENT,NOT APPLICABLE,POST GRADUATE DIPLOMA,PGDM (AGRIBUSINESS AND PLANTATION MANAGEMENT),90,JNANA BHARATHI CAMPUS P.O. MALATHALLI BANGALORE 560 056,,BANGALORE,BANGALORE URBAN,KARNATAKA,GOVERNMENT,,
1-36478105892,INDIAN INSTITUTE OF PLANTATION MANAGEMENT,MANAGEMENT,NOT APPLICABLE,POST GRADUATE DIPLOMA,PGDM (FOOD PROCESSING AND BUSINESS MANAGEMENT),60,JNANA BHARATHI CAMPUS P.O. MALATHALLI BANGALORE 560 056,,BANGALORE,BANGALORE URBAN,KARNATAKA,GOVERNMENT,,
1-36478105892,INDIAN INSTITUTE OF PLANTATION MANAGEMENT,MANAGEMENT,NOT APPLICABLE,POST GRADUATE DIPLOMA,POST GRADUATE DIPLOMA IN MANAGEMENT: AGRICULTURAL EXPORT AND BUSINESS MANAGEMENT,30,JNANA BHARATHI CAMPUS P.O. MALATHALLI BANGALORE 560 056,,BANGALORE,BANGALORE URBAN,KARNATAKA,GOVERNMENT,,
1-36596089854,KHANDELWAL VAISH GIRLS INSTITUTE OF TECHNOLOGY,MANAGEMENT,"RAJASTHAN TECHNICAL UNIVERSITY, KOTA",POST GRADUATE,MBA,60,"HANUMAN NAGAR, BLOCK E, VAISHALI NAGAR",JAIPUR,JAIPUR,JAIPUR,RAJASTHAN,PRIVATE-SELF FINANCING,,
1-36203922267,ST ALOYSIUS COLLEGE ( ST ALOYSIUS INSTITUTE OF MANAGEMENT & INFORMATION TECHNOLOGY ),MANAGEMENT,"MANGALORE UNIVERSITY, MANGALORE",POST GRADUATE,MBA,240,"KOTEKAR POST SHARADA NAGAR, 2ND CROSS MADOOR VILLAGE MANGALORE - 575022",,MANGALORE,D KANNADA(DK),KARNATAKA,PRIVATE-SELF FINANCING,,
1-36596673775,"RAJASTHAN TECHNICAL UNIVERSITY, KOTA",MANAGEMENT,"RAJASTHAN TECHNICAL UNIVERSITY, KOTA",POST GRADUATE,MBA,60,"AKELGARH, RAWATBHATA ROAD, KOTA - 324010",KOTA,KOTA,KOTA,RAJASTHAN,STATE GOVERNMENT UNIVERSITY,,
1-36207858168,INTERNATIONAL ACADEMY OF MANAGEMENT AND ENTREPRENEURSHIP,MANAGEMENT,"BANGALORE UNIVERSITY, BENGALURU",POST GRADUATE,MBA,120,"151/2, NISATHE ART OF LIVING CAMPUS, OFF KANAKAPURA ROAD, UDAYPURA POST, BANGALORE-5RGA CAMPUS, BEHIND 560082",SOUTH,BANGALORE,BANGALORE URBAN,KARNATAKA,PRIVATE-SELF FINANCING,,
1-36597234572,"GOVERNMENT WOMEN POLYTECHNIC COLLEGE, JAIPUR",MANAGEMENT,"BOARD OF TECHNICAL EDUCATION AND DIRECTORATE OF TECHNICAL EDUCATION, JODHPUR",DIPLOMA,MODERN OFFICE MANAGEMENT,30,"MAHATMA GANDHI MARG, GANDHI NAGAR",JAIPUR,JAIPUR,JAIPUR,RAJASTHAN,GOVERNMENT,,
1-36477561548,HILLSIDE INSTITUTE OF MANAGEMENT & ACADEMY,MANAGEMENT,"BANGALORE UNIVERSITY, BENGALURU",POST GRADUATE,MBA(BUSINESS MANAGEMENT),60,"#9, RAGHUVANAHALLI, KANAKAPURA MAIN ROAD, BANGALORE-560062.",,BANGALORE,BANGALORE URBAN,KARNATAKA,PRIVATE-SELF FINANCING,,
1-36937644454,MODI INSTITUTE OF MANAGEMENT & TECHNOLOGY,MANAGEMENT,"RAJASTHAN TECHNICAL UNIVERSITY, KOTA",POST GRADUATE,MBA,120,"MODI EDUCATIONAL COMPLEX, DADABARI EXTENSION",KOTA,KOTA,KOTA,RAJASTHAN,PRIVATE-SELF FINANCING,,
1-36478018568,XAVIER INSTITUTE OF MANAGEMENT & ENTREPRENEURSHIP,MANAGEMENT,NOT APPLICABLE,POST GRADUATE DIPLOMA,PGDM,240,"ELECTRONICS CITY, PHASE II, HOSUR ROAD, BANGALORE",,BANGALORE,BANGALORE RURAL,KARNATAKA,PRIVATE-SELF FINANCING,,
1-36478018568,XAVIER INSTITUTE OF MANAGEMENT & ENTREPRENEURSHIP,MANAGEMENT,NOT APPLICABLE,POST GRADUATE DIPLOMA,PGDM (BUSINESS ANALYTICS),60,"ELECTRONICS CITY, PHASE II, HOSUR ROAD, BANGALORE",,BANGALORE,BANGALORE RURAL,KARNATAKA,PRIVATE-SELF FINANCING,,
1-36937980184,PODDAR MANAGEMENT AND TECHNICAL CAMPUS,MANAGEMENT,"RAJASTHAN TECHNICAL UNIVERSITY, KOTA",POST GRADUATE,MBA,120,"GRAM: FATEHPURAVAS VATIKA, SANGANER",JAIPUR,JAIPUR,JAIPUR,RAJASTHAN,PRIVATE-SELF FINANCING,,
1-36477745290,CMR INSTITUTE OF TECHNOLOGY,MANAGEMENT,"VISVESVARAYA?TECHNOLOGICAL UNIVERSITY, BELGAUM",POST GRADUATE,MBA,120,"132, BEHIND AECS LAYOUT, IT PARK ROAD BANGALORE - 560037",,BANGALORE,BANGALORE URBAN,KARNATAKA,PRIVATE-SELF FINANCING,,
1-36938670642,VYAS INSTITUTE OF MANAGEMENT,MANAGEMENT,"BIKANER TECHNICAL UNIVERSITY, BIKANER",POST GRADUATE,MBA(BUSINESS MANAGEMENT),45,"NEAR KUDI HAUD, VILLAGE: JHALAMAND, PALI ROAD, JODHPUR-342005",JODHPUR,JODHPUR,JODHPUR,RAJASTHAN,PRIVATE-SELF FINANCING,,
1-36244581802,KRUPANIDHI SCHOOL OF MANAGEMENT,MANAGEMENT,NOT APPLICABLE,POST GRADUATE DIPLOMA,PGDM,60,#12/1 CHIKKABELLANDUR VILLAGE,EAST,BANGALORE,BANGALORE URBAN,KARNATAKA,PRIVATE-SELF FINANCING,,
1-36939973307,"FACULTY OF MANAGEMENT STUDIES, JANARDAN RAI NAGAR RAJASTHAN VIDYAPEETH (DEEMED) UNIVERSITY",MANAGEMENT,NOT APPLICABLE,POST GRADUATE,MBA,60,"FACULTY OF MANAGEMENT STUDIES, JANARDAN RAI NAGAR RAJSTHAN VIDYAPEETH(DEEMED) UNIVERSITY PRATAP NAGAR CAMPUS UDAIPUR-313001 RAJASTHAN",UDAIPUR,UDAIPUR,UDAIPUR,RAJASTHAN,DEEMED TO BE UNIVERSITY(PVT),,
1-36250579232,VANGUARD BUSINESS SCHOOL,MANAGEMENT,BANGALORE CENTRAL UNIVERSITY,POST GRADUATE,MBA,120,"#128, 38TH CROSS, EAST END MAIN ROAD, 9TH BLOCK JAYANAGAR",BANGALORE SOUTH,BANGALORE,BANGALORE URBAN,KARNATAKA,PRIVATE-SELF FINANCING,,
1-36940350621,SWAMI VIVEKANAND INSTITUTE OF MANAGEMENT & TECHNOLOGY,MANAGEMENT,"RAJASTHAN TECHNICAL UNIVERSITY, KOTA",POST GRADUATE,MBA,30,"MAA SARASWATI CAMPUS,GOTHRA,BASSI,JAIPUR-AGRA HIGHWAY,JAIPUR,RAJASTHAN APPLICATION SUBMITTED FOR ESTABLISHMENT FOR NEW TECHNICAL COLLEGE 30-10-2008 EXPERT COMMITTEE INSPECTION DATE- 24-06-2009",JAIPUR,JAIPUR,JAIPUR,RAJASTHAN,PRIVATE-SELF FINANCING,,
1-36252194353,ST FRANCIS DE SALES COLLEGE,MANAGEMENT,"BANGALORE UNIVERSITY, BENGALURU",POST GRADUATE,MBA,120,"HEBBAGODI, ELECTRONICS CITY POST, BANGALORE 560100",BANGALORE SOUTH,BANGALORE,BANGALORE URBAN,KARNATAKA,PRIVATE-SELF FINANCING,,
1-36942561743,CH. CHARAN SINGH NATIONAL INSTITUTE OF AGRICULTURAL MARKETING,MANAGEMENT,NOT APPLICABLE,POST GRADUATE DIPLOMA,"PGDM (INNOVATION, ENTREPRENEURSHIP AND VENTURE DEVELOPMENT (IEV))",30,"DIRECTOR GENERAL CH. CHARAN SINGH NATIONAL INSTITUTE OF AGRICULTURAL MARKETING, KOTA ROAD, BAMBALA, NEAR SANGANEER",JAIPUR,JAIPUR,JAIPUR,RAJASTHAN,GOVERNMENT,,
1-36942561743,CH. CHARAN SINGH NATIONAL INSTITUTE OF AGRICULTURAL MARKETING,MANAGEMENT,NOT APPLICABLE,POST GRADUATE DIPLOMA,PGDM (SUSTAINABILITY MANAGEMENT ),30,"DIRECTOR GENERAL CH. CHARAN SINGH NATIONAL INSTITUTE OF AGRICULTURAL MARKETING, KOTA ROAD, BAMBALA, NEAR SANGANEER",JAIPUR,JAIPUR,JAIPUR,RAJASTHAN,GOVERNMENT,,
1-36942561743,CH. CHARAN SINGH NATIONAL INSTITUTE OF AGRICULTURAL MARKETING,MANAGEMENT,NOT APPLICABLE,POST GRADUATE DIPLOMA,PGDM(AGRI BUSINESS MANAGEMENT),120,"DIRECTOR GENERAL CH. CHARAN SINGH NATIONAL INSTITUTE OF AGRICULTURAL MARKETING, KOTA ROAD, BAMBALA, NEAR SANGANEER",JAIPUR,JAIPUR,JAIPUR,RAJASTHAN,GOVERNMENT,,
1-36249697109,CANARABANK SCHOOL OF MANAGEMENT STUDIES BCU CAMPUS,MANAGEMENT,NOT APPLICABLE,POST GRADUATE,MBA,120,CENTRAL COLLEGE CAMPUS DR. AMBEDKAR VEEDHI BANGALORE 560001,BANGALORE CENTRAL,BANGALORE,BANGALORE URBAN,KARNATAKA,STATE GOVERNMENT UNIVERSITY,,
1-36249697109,CANARABANK SCHOOL OF MANAGEMENT STUDIES BCU CAMPUS,MANAGEMENT,NOT APPLICABLE,POST GRADUATE,MBA(SEM),60,CENTRAL COLLEGE CAMPUS DR. AMBEDKAR VEEDHI BANGALORE 560001,BANGALORE CENTRAL,BANGALORE,BANGALORE URBAN,KARNATAKA,STATE GOVERNMENT UNIVERSITY,,
1-36249929327,VISVESVARAYA TECHNOLOGICAL UNIVERSITY,MANAGEMENT,"VISVESVARAYA?TECHNOLOGICAL UNIVERSITY, BELGAUM",POST GRADUATE,MBA,120,"VTU CPGS & REGIONAL OFFICE, KUSNOOR ROAD, KALABURAGI",NORTH,KALABURAGI,GULBARGA,KARNATAKA,GOVERNMENT,,
1-36955149136,SIDDHI VINAYAK COLLEGE OF SCIENCE & HR. EDUCATION,MANAGEMENT,"BIKANER TECHNICAL UNIVERSITY, RAJASTHAN",POST GRADUATE,MBA,30,"E-I, B-1, M.I.A.(EXT.), ALWAR-301030",JAIPUR,ALWAR,ALWAR,RAJASTHAN,PRIVATE-SELF FINANCING,,
1-36956581937,SHANKARA INSTITUTE OF TECHNOLOGY,MANAGEMENT,"RAJASTHAN TECHNICAL UNIVERSITY, KOTA",POST GRADUATE,MASTERS IN COMPUTER APPLICATIONS,60,SP-44 RIICO INDUSTRIAL AREA KUKAS,JAIPUR,JAIPUR,JAIPUR,RAJASTHAN,PRIVATE-SELF FINANCING,,
1-36445355735,IMPERIAL INSTITUTE OF ADVANCED MANAGEMENT,MANAGEMENT,"BANGALORE UNIVERSITY, BENGALURU",POST GRADUATE,MBA(SEM),120,"#501,SURVEY NO 224/2 & 226/2 ,SALAHUNASE,UDAYAPURA POST,KANAKAPURA ROAD,NEAR KAGGALIPURA",BANGALORE SOUTH,BANGALORE,BANGALORE URBAN,KARNATAKA,PRIVATE-SELF FINANCING,,
1-36956915092,"SCHOOL OF ENGINEERING & TECHNOLOGY, UNIVERSITY OF TECHNOLOGY",MANAGEMENT,"UNIVERSITY OF TECHNOLOGY , JAIPUR",POST GRADUATE,MBA,120,"VILLAGE VATIKA, TEHSIL SANGANER",JAIPUR,JAIPUR,JAIPUR,RAJASTHAN,PRIVATE-SELF FINANCING,,
1-36957300657,MODERN INSTITUTE OF TECHNOLOGY & RESEARCH CENTRE,MANAGEMENT,"BIKANER TECHNICAL UNIVERSITY, BIKANER",POST GRADUATE,MBA,60,"VILLAGE- JHARKHERA, 6TH MILE STONE, TIJARA ROAD ALWAR",JAIPUR,ALWAR,ALWAR,RAJASTHAN,PRIVATE-SELF FINANCING,,
1-36445289225,SB COLLEGE OF MANAGEMENT STUDIES,MANAGEMENT,"BANGALORE CITY UNIVERSITY, BANGALORE",POST GRADUATE,MBA,120,"CA SITE NO.21, 5TH PHASE, KHB COLONY, YELAHANKA NEW TOWN, BANGALORE - 560 106",BANGALORE NORTH,BANGALORE,BANGALORE URBAN,KARNATAKA,PRIVATE-SELF FINANCING,,
1-36957687473,LAXMI DEVI INSTITUTE OF ENGINEERING AND TECHNOLOGY,MANAGEMENT,"BIKANER TECHNICAL UNIVERSITY, BIKANER",POST GRADUATE,MBA,60,"ALWAR -TIJARA - DELHI HIGHWAY, CHIKANI, ALWAR, RAJASTHAN",JAIPUR,ALWAR,ALWAR,RAJASTHAN,PRIVATE-SELF FINANCING,,
1-36261454845,LINGARAJAPPA ENGINEERING COLLEGE,MANAGEMENT,"VISVESVARAYA?TECHNOLOGICAL UNIVERSITY, BELGAUM",POST GRADUATE,MBA,60,"SURVEY NO. 25/1, GORNALLI ,BIDAR,KARNATAKA",NORTH,BIDAR,BIDAR,KARNATAKA,PRIVATE-SELF FINANCING,,
1-36958452330,REGIONAL COLLEGE FOR EDUCATION RESEARCH & TECHNOLOGY,MANAGEMENT,"RAJASTHAN TECHNICAL UNIVERSITY, KOTA",POST GRADUATE,MBA,60,"ISI-17, INSTITUTIONAL AREA SITAPURA, JAIPUR",JAIPUR,JAIPUR,JAIPUR,RAJASTHAN,PRIVATE-SELF FINANCING,,
1-36267341029,"DAYANANDA SAGAR COLLEGE OF ARTS,SCIENCE & COMMERCE",MANAGEMENT,"BANGALORE UNIVERSITY, BENGALURU",POST GRADUATE,MBA,240,SHAVIGE MALLESHWARA HILLS KUMARA SWAMY LAYOUT BANGALORE 560 078,BANGALORE SOUTH,BANGALORE,BANGALORE URBAN,KARNATAKA,PRIVATE-SELF FINANCING,,
1-36958877821,RAJASTHAN INSTITUTE OF ENGINEERING & TECHNOLOGY,MANAGEMENT,"RAJASTHAN TECHNICAL UNIVERSITY, KOTA",POST GRADUATE,MBA,45,"BHANKROTA, AJMER ROAD, JAIPUR-302026",JAIPUR,JAIPUR,JAIPUR,RAJASTHAN,PRIVATE-SELF FINANCING,,
1-36246097407,SEA COLLEGE OF SCIENCE COMMERCE AND ARTS,MANAGEMENT,"BANGALORE NORTH UNIVERSITY, BENGALURU",POST GRADUATE,MBA,120,"EKTANAGAR,VIRGONAGAR POST, K.R.PURAM, BANGALORE",EAST,BANGALORE,BANGALORE URBAN,KARNATAKA,PRIVATE-SELF FINANCING,,
1-36966868355,MAHILA TECHNICAL AND MANAGEMENT COLLEGE,MANAGEMENT,"BIKANER TECHNICAL UNIVERSITY, RAJASTHAN",POST GRADUATE,MBA,60,"KAMLA NEHRU NAGAR,SOORSAGAR ROAD",JODHPUR,JODHPUR,JODHPUR,RAJASTHAN,PRIVATE-SELF FINANCING,,
1-36247061438,SAI VIDYA INSTITUTE OF TECHNOLOGY,MANAGEMENT,"VISVESVARAYA?TECHNOLOGICAL UNIVERSITY, BELGAUM",POST GRADUATE,MBA,120,RAJANUKUNTE DODDBALLAPURA ROAD VIA: YELAHANKA,NORTH,BANGALORE,BANGALORE RURAL,KARNATAKA,PRIVATE-SELF FINANCING,,
1-36967803985,IPS COLLEGE OF TECHNICAL EDUCATION,MANAGEMENT,"RAJASTHAN TECHNICAL UNIVERSITY, KOTA",POST GRADUATE,MASTERS IN BUSINESS ADMINISTRATION,240,"ROHINI NAGAR PHASE-3, CHANDAWAS, RENWAL PHAGI ROAD",JAIPUR,JAIPUR,JAIPUR,RAJASTHAN,PRIVATE-SELF FINANCING,,
1-36245697718,CHRIST ACADEMY INSTITUTE FOR ADVANCED STUDIES,MANAGEMENT,"BANGALORE UNIVERSITY, BENGALURU",POST GRADUATE,MBA,120,"CHRIST NAGAR, HULLAHALLI, BEGUR - KOPPA ROAD, SAKKALAWARA POST, BANGALORE -560083",SOUTH-EAST,BANGALORE,BANGALORE URBAN,KARNATAKA,PRIVATE-SELF FINANCING,,
1-36967928287,FACULTY OF DAIRY TECHNOLOGY JODHPUR,MANAGEMENT,"AGRICULTURE UNIVERSITY, JODHPUR",POST GRADUATE,MBA (AGRIBUSINESS MANAGEMENT),60,BIKANER ROAD MANDOR JODHPUR,JODHPUR,JODHPUR,JODHPUR,RAJASTHAN,GOVERNMENT,,
