AICTE ID,NAME,PROGRAMME,UNIVERSITY,LEVEL OF COURSE,COURSE,INTAKE,ADDRESS,ZONE,CITY,DISTRICT,STATE,INSTITUTE TYPE,,
1-36972846936,M.K.E.S. INSTITUTE OF MANAGEMENT STUDIES AND RESEARCH,MANAGEMENT,NOT APPLICABLE,POST GRADUATE DIPLOMA,PGDM (BUSINESS ADMINISTRATION),60,"BHAVISHYA BHARAT CAMPUS, BHADRAN NAGAR, ROAD NO 1 OFF S.V. ROAD, MALAD WEST.",MUMBAI,WESTERN,MUMBAI SUBURBAN,MAHARASHTRA,PRIVATE-SELF FINANCING,,
1-36515469295,"ABASAHEB GARWARE INSTITUTE OF MANAGEMENT STUDIES, SANGLI",MANAGEMENT,"SHIVAJI UNIVERSITY, KOLHAPUR",POST GRADUATE,MBA,60,"C/O. WOMEN'S EDUCATION SOCIETY, S.T.STAND ROAD, KHANBHAG,SANGLI",SANGLI,WESTERN,SANGLI,MAHARASHTRA,PRIVATE-SELF FINANCING,,
1-36973853885,DR R G BHOYAR ARTS COMMERCE AND SCIENCE COLLEGE FORMERLY VIDYABHARTI COLLEGE,MANAGEMENT,"RASHTRASANT TUKADOJI MAHARAJ NAGPUR UNIVERSITY, NAGPUR",POST GRADUATE,MBA,60,NAGPUR- WARDHA HIGHWAY MOHANAPUR SELOO,NAGPUR,VIDARBHA,WARDHA,MAHARASHTRA,GOVT AIDED,,
1-36515471424,SAS INSTITUTE OF MANAGEMENT STUDIES,MANAGEMENT,"MUMBAI UNIVERSITY, MUMBAI",POST GRADUATE,MMS,180,"NEXT TO SAIDHAM COMPLEX, SARAVALI",MUMBAI,WESTERN,THANE,MAHARASHTRA,PRIVATE-SELF FINANCING,,
1-36974129398,M.S. COLLEGE OF MANAGEMENT,MANAGEMENT,"MUMBAI UNIVERSITY, MUMBAI",POST GRADUATE,MBA,120,"SURVEY NO. 120, VILLAGE DEVGHAR, TALUKA WADA, DISTRICT PALGHAR, THANE.",THANE,WESTERN,THANE,MAHARASHTRA,PRIVATE-SELF FINANCING,,
1-36515472084,PRAMOD RAM UJAGAR TIWARI SAKET INSTITUTE OF MANAGEMENT,MANAGEMENT,"MUMBAI UNIVERSITY, MUMBAI",POST GRADUATE,MMS,120,"CHINCHPADA ROAD, KATEMANEVLI, SAKET VIDYANAGARI MARG, KALYAN(E)",THANE,WESTERN,THANE,MAHARASHTRA,PRIVATE-SELF FINANCING,,
1-36975647441,U.D.PATHRIKAR INSTITUTE OF MANAGEMENT,MANAGEMENT,"DR. BABASAHEB AMBEDKAR MARATHWADA UNIVERSITY, AURANGABAD",POST GRADUATE,MBA,60,"AT.POST PATHRI, TQ.PHULAMBRI, DIST.AURANGABAD",AURANGABAD,VIDARBHA,AURANGABAD,MAHARASHTRA,PRIVATE-SELF FINANCING,,
1-36515472754,DR. D. Y. PATIL INSTITUTE OF MANAGEMENT STUDIES,MANAGEMENT,"UNIVERSITY OF PUNE, PUNE",POST GRADUATE,MBA,240,"SEC.29, BEHIND AKURDI RAILWAY STATION, PRADHIKARAN, NIGDI, PUNE",PUNE,WESTERN,PUNE,MAHARASHTRA,PRIVATE-SELF FINANCING,,
1-36973854286,VSS DR.SHIVAJI MADAN INSTITUTE OF MANAGEMENT,MANAGEMENT,DR. BABASAHEB AMBEDKAR MARATHWADA UNIVERSITY,POST GRADUATE,MBA,120,MAMMADEVI TO RLY STATION ROAD JALNA,JALNA,VIDARBHA,JALNA,MAHARASHTRA,PRIVATE-SELF FINANCING,,
1-36515483958,"DEPARTMENT OF MANAGEMENT SCIENCE, DR. BABASAHEB AMBEDKAR MARATHWADA UNIVERSITY, AURANGABAD",MANAGEMENT,NOT APPLICABLE,POST GRADUATE,MBA,60,"DEPARTMENT OF MANAGEMENT SCIENCE, DR. BABASAHEB AMBEDKAR MARATHWADA UNIVERSITY, AURANGABAD (MS) PIN-431004",AURANGABAD,VIDARBHA,AURANGABAD,MAHARASHTRA,STATE GOVERNMENT UNIVERSITY,,
1-36515483958,"DEPARTMENT OF MANAGEMENT SCIENCE, DR. BABASAHEB AMBEDKAR MARATHWADA UNIVERSITY, AURANGABAD",MANAGEMENT,NOT APPLICABLE,POST GRADUATE,MBA,1000,"DEPARTMENT OF MANAGEMENT SCIENCE, DR. BABASAHEB AMBEDKAR MARATHWADA UNIVERSITY, AURANGABAD (MS) PIN-431004",AURANGABAD,VIDARBHA,AURANGABAD,MAHARASHTRA,STATE GOVERNMENT UNIVERSITY,,
1-36973910212,NATIONAL ACADEMY OF DEFENCE PRODUCTION,MANAGEMENT,NOT APPLICABLE,POST GRADUATE DIPLOMA,PGDM (BUSINESS MANAGEMENT ),60,"ORDNANCE FACTORY AMBAJHARI ESTATE, AMBAJHARI, NAGPUR - 440021",NAGPUR,VIDARBHA,NAGPUR,MAHARASHTRA,GOVERNMENT,,
1-36973910212,NATIONAL ACADEMY OF DEFENCE PRODUCTION,MANAGEMENT,NOT APPLICABLE,POST GRADUATE DIPLOMA,PGDM (BUSINESS MANAGEMENT ),60,"ORDNANCE FACTORY AMBAJHARI ESTATE, AMBAJHARI, NAGPUR - 440021",NAGPUR,VIDARBHA,NAGPUR,MAHARASHTRA,GOVERNMENT,,
1-36967856309,JAY BHAVANI INSTITUTE OF MANAGEMENT,MANAGEMENT,"DR. BABASAHEB AMBEDKAR MARATHWADA UNIVERSITY, AURANGABAD",POST GRADUATE,MASTERS IN BUSINESS ADMINISTRATION,120,GUT NO 209 INFRONT OF COLLEGE OF AGRICULTURE BADNAPUR JALNA AURANGABAD ROAD BADNAPUR,JALNA,VIDARBHA,JALNA,MAHARASHTRA,PRIVATE-SELF FINANCING,,
1-36515484735,DR.ARUN MOTGHARE COLLEGE OF MANAGEMENT,MANAGEMENT,"RASHTRASANT TUKADOJI MAHARAJ NAGPUR UNIVERSITY, NAGPUR",POST GRADUATE,MBA(BUSINESS MANAGEMENT),60,KOSRA KONDHA BHANDARA,BHANDARA,VIDARBHA,BHANDARA,MAHARASHTRA,PRIVATE-SELF FINANCING,,
1-36968027585,RAMACHANDRAN INTERNATIONAL INSTITUTE OF MANAGEMENT,MANAGEMENT,NOT APPLICABLE,POST GRADUATE DIPLOMA,PGDM,240,"MANTRI ALPINE, BUILDING C, SR. NO. 268, BAVDHAN BUDRUK, PUNE - 411021",PUNE,WESTERN,PUNE,MAHARASHTRA,PRIVATE-SELF FINANCING,,
1-36515485391,INDIRA INSTITUTE OF MANAGEMENT SCIENCES,MANAGEMENT,"SWAMI RAMANAND TEERTH MARATHWADA UNIVERSITY, NANDED",POST GRADUATE,MBA,120,"AT POST VISHNUPURI, TQ DIST NANDED-06",NANDED,VIDARBHA,NANDED,MAHARASHTRA,PRIVATE-SELF FINANCING,,
1-36967494308,AHIRKAR INSTITUTE OF MANAGEMENT STUDIES,MANAGEMENT,"RASHTRASANT TUKADOJI MAHARAJ NAGPUR UNIVERSITY, NAGPUR",POST GRADUATE,MASTERS IN BUSINESS ADMINISTRATION,240,"AT KHASRA NO. 60/2 & 60/3, MOUZA - ISASANI, BEHIND MIHAN, GATE NO. 3, TAHSIL - HINGNA, DISTRICT - NAGPUR.",NAGPUR,VIDARBHA,NAGPUR,MAHARASHTRA,PRIVATE-SELF FINANCING,,
1-36515486794,"ASM'S INSTITUTE OF BUSINESS MANAGEMENT & RESEARCH (PGDM), PUNE",MANAGEMENT,NOT APPLICABLE,POST GRADUATE DIPLOMA,PGDM(BUSINESS ADMINISTRATION),120,"PLOT NO.133, MIDC, BLOCK C', CHINCHWAD, PUNE 411019",PUNE,WESTERN,PUNE,MAHARASHTRA,PRIVATE-SELF FINANCING,,
1-36515486794,"ASM'S INSTITUTE OF BUSINESS MANAGEMENT & RESEARCH (PGDM), PUNE",MANAGEMENT,NOT APPLICABLE,POST GRADUATE DIPLOMA,PGDM(RESEARCH AND BUSINESS ANALYTICS),60,"PLOT NO.133, MIDC, BLOCK C', CHINCHWAD, PUNE 411019",PUNE,WESTERN,PUNE,MAHARASHTRA,PRIVATE-SELF FINANCING,,
1-36967855419,DR ARUN MOTGHARE MAHAVIDYALAYA MBA,MANAGEMENT,"RASHTRASANT TUKADOJI MAHARAJ NAGPUR UNIVERSITY, NAGPUR",POST GRADUATE,MASTERS IN BUSINESS ADMINISTRATION,120,"SURVEY NO. 442, 443, 445, 441/2/2, 444, 446/3B, 446/3A, MOUZA- KOSRA- KONDA, TAH.- PAUNI DIST BHANDARA",BHANDARA,VIDARBHA,BHANDARA,MAHARASHTRA,PRIVATE-SELF FINANCING,,
1-36968304645,SYMBIOSIS INTERNATIONAL (DEEMED UNIVERSITY),MANAGEMENT,NOT APPLICABLE,POST GRADUATE,MASTER OF BUSINESS ADMINISTRATION (FOOD AND AGRI BUSINESS MANAGEMENT),30,"CAMPUS GAT. NO.167,168,169, VILLAGE MAUJE, BHANDEWADI, WATHODA LAYOUT, NAGPUR, MAHARASHTRA 440008",NAGPUR,VIDARBHA,PUNE,MAHARASHTRA,DEEMED TO BE UNIVERSITY(PVT),,
1-36968304645,SYMBIOSIS INTERNATIONAL (DEEMED UNIVERSITY),MANAGEMENT,NOT APPLICABLE,POST GRADUATE,MASTERS OF BUSINESS ADMINISTRATION,180,"CAMPUS GAT. NO.167,168,169, VILLAGE MAUJE, BHANDEWADI, WATHODA LAYOUT, NAGPUR, MAHARASHTRA 440008",NAGPUR,VIDARBHA,PUNE,MAHARASHTRA,DEEMED TO BE UNIVERSITY(PVT),,
1-36968304645,SYMBIOSIS INTERNATIONAL (DEEMED UNIVERSITY),MANAGEMENT,NOT APPLICABLE,POST GRADUATE,MBA (GENERAL),30,"CAMPUS GAT. NO.167,168,169, VILLAGE MAUJE, BHANDEWADI, WATHODA LAYOUT, NAGPUR, MAHARASHTRA 440008",NAGPUR,VIDARBHA,PUNE,MAHARASHTRA,DEEMED TO BE UNIVERSITY(PVT),,
1-36515491964,MAHATMA PHULE INSTITUTE OF MANAGEMENT AND COMPUTER STUDIES,MANAGEMENT,"UNIVERSITY OF PUNE, PUNE",POST GRADUATE,MBA,120,"A.M.COLLEGE CAMPUS, MANJARI ROAD,HADAPSAR, PUNE-28",PUNE,WESTERN,PUNE,MAHARASHTRA,PRIVATE-SELF FINANCING,,
1-36970662073,INSTITUTE OF MANAGEMENT & CAREER COURSES,MANAGEMENT,"SAVITRIBAI PHULE PUNE UNIVERSITY, PUNE",POST GRADUATE,MBA,180,"131, MAYUR COLONY, KOTHRUD",PUNE,WESTERN,PUNE,MAHARASHTRA,PRIVATE-SELF FINANCING,,
1-36515494780,"DECCAN EDUCATION SOCIETY'S CHINTAMANRAO INSTITUTE OF MANAGEMENT DEVELOPMENT AND RESEARCH, SANGLI",MANAGEMENT,"SHIVAJI UNIVERSITY, KOLHAPUR",POST GRADUATE,MBA,60,"P.O. WILLINGDON COLLEGE , DES CAMPUS, VISHRAMBAG ,SANGLI",SANGLI,WESTERN,SANGLI,MAHARASHTRA,PRIVATE-SELF FINANCING,,
1-36972612421,JIO INSTITUTE,MANAGEMENT,NOT APPLICABLE,FELLOWSHIP,MANAGEMENT,10,"SECTOR-4, ULWE, NAVI MUMBAI, MAHARASHTRA- 410206",NAVI MUMBAI,WESTERN,RAIGAD,MAHARASHTRA,PRIVATE-SELF FINANCING,,
1-36972612421,JIO INSTITUTE,MANAGEMENT,NOT APPLICABLE,POST GRADUATE CERTIFICATE,PGCM (FINTECH),60,"SECTOR-4, ULWE, NAVI MUMBAI, MAHARASHTRA- 410206",NAVI MUMBAI,WESTERN,RAIGAD,MAHARASHTRA,PRIVATE-SELF FINANCING,,
1-36972612421,JIO INSTITUTE,MANAGEMENT,NOT APPLICABLE,POST GRADUATE CERTIFICATE,PGCM(DIGITAL MEDIA AND MARKETING COMMUNICATIONS),60,"SECTOR-4, ULWE, NAVI MUMBAI, MAHARASHTRA- 410206",NAVI MUMBAI,WESTERN,RAIGAD,MAHARASHTRA,PRIVATE-SELF FINANCING,,
1-36972612421,JIO INSTITUTE,MANAGEMENT,NOT APPLICABLE,POST GRADUATE CERTIFICATE,PGCM(HEALTHCARE MANAGEMENT),30,"SECTOR-4, ULWE, NAVI MUMBAI, MAHARASHTRA- 410206",NAVI MUMBAI,WESTERN,RAIGAD,MAHARASHTRA,PRIVATE-SELF FINANCING,,
1-36972612421,JIO INSTITUTE,MANAGEMENT,NOT APPLICABLE,POST GRADUATE CERTIFICATE,PGCM(MASS COMMUNICATION),60,"SECTOR-4, ULWE, NAVI MUMBAI, MAHARASHTRA- 410206",NAVI MUMBAI,WESTERN,RAIGAD,MAHARASHTRA,PRIVATE-SELF FINANCING,,
1-36972612421,JIO INSTITUTE,MANAGEMENT,NOT APPLICABLE,POST GRADUATE CERTIFICATE,PGCM(SPORTS MANAGEMENT),60,"SECTOR-4, ULWE, NAVI MUMBAI, MAHARASHTRA- 410206",NAVI MUMBAI,WESTERN,RAIGAD,MAHARASHTRA,PRIVATE-SELF FINANCING,,
1-36515502174,"SAHYADRI INSTITUTE OF MANAGEMENT & RESERCH, SAWARDE",MANAGEMENT,"MUMBAI UNIVERSITY, MUMBAI",POST GRADUATE,MBA,60,A/P- SAWARDE TAL- CHIPLUN DIST:- RATNAGIRI,RATNAGIRI,KONKAN,RATNAGIRI,MAHARASHTRA,PRIVATE-SELF FINANCING,,
1-36968407279,WESTERN BUSINESS SCHOOL PUNE,MANAGEMENT,NOT APPLICABLE,POST GRADUATE DIPLOMA,PGDM (AGRIBUSINESS AND PLANTATION MANAGEMENT),60,"CHAKAN TALEGAON ROAD , SUDUMBARE ,PUNE-412109",PUNE,WESTERN,PUNE,MAHARASHTRA,PRIVATE-SELF FINANCING,,
1-36968407279,WESTERN BUSINESS SCHOOL PUNE,MANAGEMENT,NOT APPLICABLE,POST GRADUATE DIPLOMA,PGDM (GENERAL),120,"CHAKAN TALEGAON ROAD , SUDUMBARE ,PUNE-412109",PUNE,WESTERN,PUNE,MAHARASHTRA,PRIVATE-SELF FINANCING,,
1-36515503480,"NSCT'S INSTITUTE OF MANAGEMENT SCIENCE, PIMPRI(BK)",MANAGEMENT,"UNIVERSITY OF PUNE, PUNE",POST GRADUATE,MBA,120,AT/POST PIMPRI (BK) PAYEET ROAD TAL KHED DIST PUNE,PUNE,WESTERN,PUNE,MAHARASHTRA,PRIVATE-SELF FINANCING,,
1-36968506158,SYMBIOSIS INTERNATIONAL (DEEMED UNIVERSITY),MANAGEMENT,NOT APPLICABLE,POST GRADUATE,MASTER OF BUSINESS ADMINISTRATION (AGRI OPERATIONS MANAGEMENT),30,"PLOT NO.A-23, SHRAVAN SECTOR, NEW CIDCO, NASHIK, MAHARASHTRA 422008",NASHIK,WESTERN,NASHIK,MAHARASHTRA,DEEMED TO BE UNIVERSITY(PVT),,
1-36968506158,SYMBIOSIS INTERNATIONAL (DEEMED UNIVERSITY),MANAGEMENT,NOT APPLICABLE,POST GRADUATE,MASTER OF BUSINESS ADMINISTRATION (OPERATIONS MANAGEMENT),150,"PLOT NO.A-23, SHRAVAN SECTOR, NEW CIDCO, NASHIK, MAHARASHTRA 422008",NASHIK,WESTERN,NASHIK,MAHARASHTRA,DEEMED TO BE UNIVERSITY(PVT),,
1-36515508951,TIRPUDE INSTITUTE OF MANAGEMENT EDUCATION,MANAGEMENT,"RASHTRASANT TUKADOJI MAHARAJ NAGPUR UNIVERSITY, NAGPUR",POST GRADUATE,MBA,180,"1, BALASAHEB TIRPUDE MARG, CIVIL LINES, SADAR, NAGPUR",NAGPUR,VIDARBHA,NAGPUR,MAHARASHTRA,PRIVATE-SELF FINANCING,,
1-36522992407,"PRIYADARSHINI LOKMANYA TILAK INSTITUTE OF MANAGEMENT STUDIES & RESEARCH, NAGPUR",MANAGEMENT,"RASHTRASANT TUKADOJI MAHARAJ NAGPUR UNIVERSITY, NAGPUR",POST GRADUATE,MBA,120,"OPP. LATA MANGESHKAR HOSPITAL, DIGDOH HILLS, HINGNA ROAD, NAGPUR- 440 019.",NAGPUR,VIDARBHA,NAGPUR,MAHARASHTRA,PRIVATE-SELF FINANCING,,
1-36515519645,RIIM-THE ACADEMY SCHOOL OF BUSINESS MANAGEMENT,MANAGEMENT,"UNIVERSITY OF PUNE, PUNE",POST GRADUATE,MBA,180,"SR.NO.31, NEAR DANGE CHOWK , TATHAWADE ROAD,TATHAWADE PUNE- 411033.M.S.",PUNE,WESTERN,PUNE,MAHARASHTRA,PRIVATE-SELF FINANCING,,
1-36515529098,ANEKANT INSTITITE OF MANAGEMENT STUDIES,MANAGEMENT,"UNIVERSITY OF PUNE, PUNE",POST GRADUATE,MBA,120,"ANEKANT EDUCATION SOCIETY CAMPUS, BARAMATI, DIST.PUNE",PUNE,WESTERN,PUNE,MAHARASHTRA,PRIVATE-SELF FINANCING,,
1-36515530635,MITTHULALJI SARDA MBA COLLEGE,MANAGEMENT,"DR. BABASAHEB AMBEDKAR MARATHWADA UNIVERSITY, AURANGABAD",POST GRADUATE,MBA,60,"SARDA ESTATE NALWANDI ROAD, BEED",BEED,VIDARBHA,BEED,MAHARASHTRA,PRIVATE-SELF FINANCING,,
1-36515530635,MITTHULALJI SARDA MBA COLLEGE,MANAGEMENT,"DR. BABASAHEB AMBEDKAR MARATHWADA UNIVERSITY, AURANGABAD",POST GRADUATE,MBA(FINANCE),60,"SARDA ESTATE NALWANDI ROAD, BEED",BEED,VIDARBHA,BEED,MAHARASHTRA,PRIVATE-SELF FINANCING,,
1-36515530635,MITTHULALJI SARDA MBA COLLEGE,MANAGEMENT,"DR. BABASAHEB AMBEDKAR MARATHWADA UNIVERSITY, AURANGABAD",POST GRADUATE,MBA(MARKETING MANAGEMENT),60,"SARDA ESTATE NALWANDI ROAD, BEED",BEED,VIDARBHA,BEED,MAHARASHTRA,PRIVATE-SELF FINANCING,,
1-36515533452,NATIONAL INSTITUTE OF BANK MANAGEMENT,MANAGEMENT,NOT APPLICABLE,POST GRADUATE DIPLOMA,PGDM(BANKING AND FINANCIAL SERVICES),180,NIBM CAMPUS NIBM PO,PUNE,WESTERN,PUNE,MAHARASHTRA,PRIVATE-SELF FINANCING,,
1-36515542535,G.H.RAISONI INSTITUTE OF MANAGEMENT AND RESEARCH,MANAGEMENT,"RASHTRASANT TUKADOJI MAHARAJ NAGPUR UNIVERSITY, NAGPUR",POST GRADUATE,MBA,180,"NEAR PRINCE LAWN,BABUBHAI COLONY, CHICHOLI,KHAPERKHEDA, NAGPUR,441102",NAGPUR,VIDARBHA,NAGPUR,MAHARASHTRA,PRIVATE-SELF FINANCING,,
1-36515556119,BHARATI VIDYAPEETH DEEMED UNIVERSITY INSTITUTE OF MANAGEMENT AND RURAL DEVELOPMENT ADMINISTRATION,MANAGEMENT,"BHARATI VIDYAPEETH UNIVERSITY, PUNE",POST GRADUATE,MBA,60,"BHARATI BHAVAN, RAJWADA CHOWK, SANGLI-416416 MAHARASHTRA",SANGLI,WESTERN,SANGLI,MAHARASHTRA,PRIVATE-SELF FINANCING,,
1-36515558469,HON.SHRI BABANRAO PACHPUTE VICHARDHARA TRUST'S GROUP OF INSTITUTIONS,MANAGEMENT,"UNIVERSITY OF PUNE, PUNE",POST GRADUATE,MBA,60,"A/P KASHTI, TAL: SHRIGONDA DIST: AHMEDNAGAR MAHARASHTRA - 414701",AHMEDNAGAR,WESTERN,AHMEDNAGAR,MAHARASHTRA,PRIVATE-SELF FINANCING,,
1-36515558469,HON.SHRI BABANRAO PACHPUTE VICHARDHARA TRUST'S GROUP OF INSTITUTIONS,MANAGEMENT,"UNIVERSITY OF PUNE, PUNE",POST GRADUATE,MBA(BUSINESS MANAGEMENT),60,"A/P KASHTI, TAL: SHRIGONDA DIST: AHMEDNAGAR MAHARASHTRA - 414701",AHMEDNAGAR,WESTERN,AHMEDNAGAR,MAHARASHTRA,PRIVATE-SELF FINANCING,,
1-36515561164,MODERN INSTITUTE OF BUSINESS MANAGEMENT,MANAGEMENT,"UNIVERSITY OF PUNE, PUNE",POST GRADUATE,MBA,180,"1186, SHIVAJINAGAR, PUNE",PUNE,WESTERN,PUNE,MAHARASHTRA,PRIVATE-SELF FINANCING,,
1-36515570790,ASM'S INSTITUTE OF BUSINESS MANAGEMENT & RESEARCH MBA INSTITUTE,MANAGEMENT,"UNIVERSITY OF PUNE, PUNE",POST GRADUATE,MBA,360,"MIDC, BLOCK 'C', CHINCHWAD, PUNE-411019",PUNE,WESTERN,PUNE,MAHARASHTRA,PRIVATE-SELF FINANCING,,
1-36515577866,SWARAJ INSTITUTE OF MANAGEMENT,MANAGEMENT,"SHIVAJI UNIVERSITY, KOLHAPUR",POST GRADUATE,MBA,60,"S. NO.-636, NH-4,AT-VAHAGAON,POST-VANVASMACHI,TAL.-KARAD,DIST-SATARA",SATARA,WESTERN,SATARA,MAHARASHTRA,PRIVATE-SELF FINANCING,,
1-36515579353,"DHANANJAYRAO GADGIL INSTITUTE OF CO-OP MANAGEMENT,NAGPUR",MANAGEMENT,"RASHTRASANT TUKADOJI MAHARAJ NAGPUR UNIVERSITY, NAGPUR",POST GRADUATE,MBA,30,"ICM BUS STOP,MINI BYEPASS ROAD,NEW NANDANWAN NAGPUR-09",NAGPUR,VIDARBHA,NAGPUR,MAHARASHTRA,GOVERNMENT,,
1-36515580008,MARATHWADA INSTITUTE OF MANAGEMENT AND RESEARCH,MANAGEMENT,"DR. BABASAHEB AMBEDKAR MARATHWADA UNIVERSITY, AURANGABAD",POST GRADUATE,MBA,60,"GUT NO.166, BEED BYPASS ROAD, SATARA PARISAR, AURANGABAD - 431005",AURANGABAD,VIDARBHA,AURANGABAD,MAHARASHTRA,PRIVATE-SELF FINANCING,,
1-36515591617,TRINITY INSTITUTE OF MANAGEMENT & RESEARCH,MANAGEMENT,"UNIVERSITY OF PUNE, PUNE",POST GRADUATE,MBA,120,"SR. NO.25 & 27, VILLAGE - PISOLI, POST- YEWALEWADI (BOPDEV GHAT)",PUNE,WESTERN,PUNE,MAHARASHTRA,PRIVATE-SELF FINANCING,,
1-36515592316,INSTITUTE OF MANAGEMENT AND RESEARCH,MANAGEMENT,"UNIVERSITY OF PUNE, PUNE",POST GRADUATE,MBA,120,"S.NO.74/1A,74/1B, PARVATI, ARANEYSHWAR, PUNE",PUNE,WESTERN,PUNE,MAHARASHTRA,PRIVATE-SELF FINANCING,,
1-36515594908,G.H.RAISONI SCHOOL OF BUSINESS MANAGEMENT,MANAGEMENT,"RASHTRASANT TUKADOJI MAHARAJ NAGPUR UNIVERSITY, NAGPUR",POST GRADUATE,MBA,180,"MADHAV NAGARI,NEAR CRPF GATE NO. 3,",NAGPUR,VIDARBHA,NAGPUR,MAHARASHTRA,PRIVATE-SELF FINANCING,,
1-36515595694,SHRI SANT GAJANAN MAHARAJ COLLEGE OF ENGINEERING,MANAGEMENT,"SANT GADGE BABA AMRAVATI UNIVERSITY, AMRAVATI",POST GRADUATE,MBA,60,"ENGINEERING CAMPUS , KHAMGAON ROAD, SHEGAON 444 203 DIST BULDHANA MAHARASHTRA",BULDHANA,VIDARBHA,BULDHANA,MAHARASHTRA,PRIVATE-SELF FINANCING,,
1-36515601807,BALAJI INSTITUTE OF MANAGEMENT AND HUMAN RESOURCE DEVELOPMENT (BIMHRD),MANAGEMENT,"SRI BALAJI UNIVERSITY, PUNE",POST GRADUATE,MBA,120,"SURVEY NO. 55/2-7, TATHAWADE, PUNE-411033",PUNE,WESTERN,PUNE,MAHARASHTRA,PRIVATE-SELF FINANCING,,
1-36515601807,BALAJI INSTITUTE OF MANAGEMENT AND HUMAN RESOURCE DEVELOPMENT (BIMHRD),MANAGEMENT,"SRI BALAJI UNIVERSITY, PUNE",POST GRADUATE,MBA(MARKETING MANAGEMENT),60,"SURVEY NO. 55/2-7, TATHAWADE, PUNE-411033",PUNE,WESTERN,PUNE,MAHARASHTRA,PRIVATE-SELF FINANCING,,
1-36515601807,BALAJI INSTITUTE OF MANAGEMENT AND HUMAN RESOURCE DEVELOPMENT (BIMHRD),MANAGEMENT,"SRI BALAJI UNIVERSITY, PUNE",POST GRADUATE,MBA(PERSONNEL MANAGEMENT AND HUMAN RESOURCE DEVELOPMENT),60,"SURVEY NO. 55/2-7, TATHAWADE, PUNE-411033",PUNE,WESTERN,PUNE,MAHARASHTRA,PRIVATE-SELF FINANCING,,
1-36515604948,SHIKSHAN MAHARSHI DR. D. Y. PATIL CENTER FOR MANAGEMENT AND RESEARCH,MANAGEMENT,"UNIVERSITY OF PUNE, PUNE",POST GRADUATE,MBA,180,"GAT NO 1029,1030.1031 NEXT TO THERMAX SQUARE,NEWALE WASTI, CHIKHALI PUNE 412114",PUNE,WESTERN,PUNE,MAHARASHTRA,PRIVATE-SELF FINANCING,,
1-36515609373,SAU. LEENA KISHOR MAMIDWAR INSTITUTE OF MANAGEMENT STUDIES AND RESEARCH,MANAGEMENT,"GONDWANA UNIVERSITY, GADCHIROLI",POST GRADUATE,MBA,180,"SAU. LEENA KISHOR MAMIDWAR INSTITUTE OF MANAGEMENT STUDIES & RESEARCH,OPP. SHARMA PETROL PUMP, KOSARA, CHANDRAPUR",CHANDRAPUR,VIDARBHA,CHANDRAPUR,MAHARASHTRA,PRIVATE-SELF FINANCING,,
1-36515699610,BALAJI INSTITUTE OF INTERNATIONAL BUSINESS (BIIB),MANAGEMENT,"SRI BALAJI UNIVERSITY, PUNE",POST GRADUATE,MBA(FINANCE MANAGEMENT),60,"S.NO.-55/2-7, VILLAGE TATHAWADE",PUNE,WESTERN,PUNE,MAHARASHTRA,PRIVATE-SELF FINANCING,,
1-36515699610,BALAJI INSTITUTE OF INTERNATIONAL BUSINESS (BIIB),MANAGEMENT,"SRI BALAJI UNIVERSITY, PUNE",POST GRADUATE,MBA(INTERNATIONAL BUSINESS),60,"S.NO.-55/2-7, VILLAGE TATHAWADE",PUNE,WESTERN,PUNE,MAHARASHTRA,PRIVATE-SELF FINANCING,,
1-36515699610,BALAJI INSTITUTE OF INTERNATIONAL BUSINESS (BIIB),MANAGEMENT,"SRI BALAJI UNIVERSITY, PUNE",POST GRADUATE,MBA(MARKETING MANAGEMENT),60,"S.NO.-55/2-7, VILLAGE TATHAWADE",PUNE,WESTERN,PUNE,MAHARASHTRA,PRIVATE-SELF FINANCING,,
1-36515766103,"DEPARTMENT OF MANAGEMENT SCIENCES AND RESEARCH, G.S. COLLEGE OF COMMERCE AND ECONOMICS, NAGPUR",MANAGEMENT,"RASHTRASANT TUKADOJI MAHARAJ NAGPUR UNIVERSITY, NAGPUR",POST GRADUATE,MBA(BUSINESS MANAGEMENT),60,"AMRAVATI ROAD, CIVIL LINES, LAW COLLEGE SQUARE, NAGPUR",NAGPUR,VIDARBHA,NAGPUR,MAHARASHTRA,PRIVATE-SELF FINANCING,,
1-36516211295,"CHRIST (DEEMED TO BE UNIVERSITY), PUNE LAVASA CAMPUS",MANAGEMENT,NOT APPLICABLE,POST GRADUATE,MBA,180,"DASVE LAVASA, LAVASA",PUNE,WESTERN,PUNE,MAHARASHTRA,DEEMED TO BE UNIVERSITY(PVT),,
1-36516212020,AKOLE TALUKA EDUCATION SOCIETY'S TECHNICAL CAMPUS,MANAGEMENT,"UNIVERSITY OF PUNE, PUNE",POST GRADUATE,MBA,120,"AT POST AKOLE, TALUKA AKOLE, KOLHAT GHOTI ROAD, AKOLE",AHMEDNAGAR,WESTERN,AHMEDNAGAR,MAHARASHTRA,PRIVATE-SELF FINANCING,,
1-36516257864,VISHWESHWAR EDUCATION SOCIETY'S INDIRA INSTITUTE OF BUSINESS MANAGEMENT,MANAGEMENT,"MUMBAI UNIVERSITY, MUMBAI",POST GRADUATE,MMS,120,"PLOT NO.2, SECTOR-9, SANPADA, NAVI MUMBAI",NAVI MUMBAI,WESTERN,THANE,MAHARASHTRA,PRIVATE-SELF FINANCING,,
1-36516339244,SAIBALAJI INTERNATIONAL INTSTITUTE OF MANAGEMENT SCIENCES,MANAGEMENT,"UNIVERSITY OF PUNE, PUNE",POST GRADUATE,MBA,180,"SURVEY NO # 54, NERE MARUNJE, NEAR HINJEWADI IT PARK, PUNE-411033",PUNE,WESTERN,PUNE,MAHARASHTRA,PRIVATE-SELF FINANCING,,
1-36516464092,"DEPARTMENT OF MNAGEMENT SCIENCES & RESEARCH J.M.PATEL COLLEGE, BHANDARA",MANAGEMENT,"RASHTRASANT TUKADOJI MAHARAJ NAGPUR UNIVERSITY, NAGPUR",POST GRADUATE,MBA,60,J.M.PATEL COLLEGE BHANDARA 441904 (M.S.),BHANDARA,VIDARBHA,BHANDARA,MAHARASHTRA,PRIVATE-SELF FINANCING,,
1-36516586991,SCHOOL OF COMMERCE AND MANAGEMENT SCIENCES,MANAGEMENT,"SWAMI RAMANAND TEERTH MARATHWADA UNIVERSITY, NANDED",POST GRADUATE,MBA,60,"SWAMI RAMANAND TEERTH MARATHWADA UNIVERSITY, DYANTEERTH, VISHNUPURI, NANDED - 431606",NANDED,VIDARBHA,NANDED,MAHARASHTRA,GOVERNMENT,,
1-36516963757,INSTITUTE OF MANAGEMENT AND SCIENCE,MANAGEMENT,"KAVAYITRI BAHINABAI CHAUDHARI NORTH MAHARASHTRA UNIVERSITY, JALGAON",POST GRADUATE,MBA,60,"NH NO. 6, SAKEGAON, TAL. BHUSAWAL, DIST. JALGAON",JALGAON,KHANDESH,JALGAON,MAHARASHTRA,PRIVATE-SELF FINANCING,,
1-36517050026,"INSTITUTE OF MANAGEMENT TECHNOLOGY, NAGPUR",MANAGEMENT,NOT APPLICABLE,FELLOWSHIP,FELLOW PROGRAM IN MANAGEMENT,20,"INSTITUTE OF MANAGEMENT TECHNOLOGY, NAGPUR35 KM MILESTONE, KATOL ROAD, NAGPUR - 441502, INDIA.PHONE : +91-712-2805000, FAX : +91-712-2805591.",NAGPUR,VIDARBHA,NAGPUR,MAHARASHTRA,PRIVATE-SELF FINANCING,,
1-36517050026,"INSTITUTE OF MANAGEMENT TECHNOLOGY, NAGPUR",MANAGEMENT,NOT APPLICABLE,POST GRADUATE DIPLOMA,PGDM,180,"INSTITUTE OF MANAGEMENT TECHNOLOGY, NAGPUR35 KM MILESTONE, KATOL ROAD, NAGPUR - 441502, INDIA.PHONE : +91-712-2805000, FAX : +91-712-2805591.",NAGPUR,VIDARBHA,NAGPUR,MAHARASHTRA,PRIVATE-SELF FINANCING,,
1-36517050026,"INSTITUTE OF MANAGEMENT TECHNOLOGY, NAGPUR",MANAGEMENT,NOT APPLICABLE,POST GRADUATE DIPLOMA,PGDM(FINANCIAL MANAGEMENT),60,"INSTITUTE OF MANAGEMENT TECHNOLOGY, NAGPUR35 KM MILESTONE, KATOL ROAD, NAGPUR - 441502, INDIA.PHONE : +91-712-2805000, FAX : +91-712-2805591.",NAGPUR,VIDARBHA,NAGPUR,MAHARASHTRA,PRIVATE-SELF FINANCING,,
1-36517050026,"INSTITUTE OF MANAGEMENT TECHNOLOGY, NAGPUR",MANAGEMENT,NOT APPLICABLE,POST GRADUATE DIPLOMA,PGDM(MARKETING),120,"INSTITUTE OF MANAGEMENT TECHNOLOGY, NAGPUR35 KM MILESTONE, KATOL ROAD, NAGPUR - 441502, INDIA.PHONE : +91-712-2805000, FAX : +91-712-2805591.",NAGPUR,VIDARBHA,NAGPUR,MAHARASHTRA,PRIVATE-SELF FINANCING,,
1-36517639553,D. Y. PATIL UNIVERSITY SCHOOL OF MANAGEMENT,MANAGEMENT,"D. Y. PATIL UNIVERSITY, PUNE",POST GRADUATE,MBA,120,"SR. NO. 124 & 126, A/P AMBI, TALEGAON - DABHADE,TAL MAVAL,DIST PUNE",PUNE,WESTERN,PUNE,MAHARASHTRA,PRIVATE-SELF FINANCING,,
1-36517707781,SCHOOL OF MANAGEMENT STUDIES,MANAGEMENT,NOT APPLICABLE,POST GRADUATE,MBA,61,"NORTH MAHARASHTRA UNIVERSITY, POST BOX NO. 80, UMAVI NAGAR, JALGAON 425001",JALGAON,KHANDESH,JALGAON,MAHARASHTRA,STATE GOVERNMENT UNIVERSITY,,
1-36517982488,KARMAVEER BHAUSAHEB HIRAY INSTITUTE OF MANAGEMENT AND RESEARCH,MANAGEMENT,SAVITRIBAI PHULE PUNE UNIVERSITY,POST GRADUATE,MBA,60,"LOKNETE VYANKATRAO HIRAY MARG, MALEGAON CAMP.",NASHIK,WESTERN,NASHIK,MAHARASHTRA,PRIVATE-SELF FINANCING,,
1-36518016881,NASHI DISTRICT MARATHA VIDYA PRASARAK SAMAJA'S INSTITUTE OF MANAGEMENT RESEARCH & TECHNOLOGY,MANAGEMENT,"UNIVERSITY OF PUNE, PUNE",POST GRADUATE,MBA,60,"MVP CAMPUS, GANGAPUR ROAD,NASHIK-02",NASHIK,WESTERN,NASHIK,MAHARASHTRA,PRIVATE-SELF FINANCING,,
1-36518016881,NASHI DISTRICT MARATHA VIDYA PRASARAK SAMAJA'S INSTITUTE OF MANAGEMENT RESEARCH & TECHNOLOGY,MANAGEMENT,"UNIVERSITY OF PUNE, PUNE",POST GRADUATE,MBA(HUMAN RESOURCE DEVELOPMENT),60,"MVP CAMPUS, GANGAPUR ROAD,NASHIK-02",NASHIK,WESTERN,NASHIK,MAHARASHTRA,PRIVATE-SELF FINANCING,,
1-36518016881,NASHI DISTRICT MARATHA VIDYA PRASARAK SAMAJA'S INSTITUTE OF MANAGEMENT RESEARCH & TECHNOLOGY,MANAGEMENT,"UNIVERSITY OF PUNE, PUNE",POST GRADUATE,MBA(INFORMATION TECHNOLOGY),60,"MVP CAMPUS, GANGAPUR ROAD,NASHIK-02",NASHIK,WESTERN,NASHIK,MAHARASHTRA,PRIVATE-SELF FINANCING,,
1-36518077568,CHETANA'S INSTITUTE OF MANAGEMENT AND RESEARCH,MANAGEMENT,NOT APPLICABLE,FELLOWSHIP,BUSINESS MANAGEMENT,10,"SURVEY NO. 341, GOVT. COLONY, BANDRA (E), MUMBAI 400051 MAHARASHTRA",MUMBAI,WESTERN,MUMBAI SUBURBAN,MAHARASHTRA,PRIVATE-SELF FINANCING,,
1-36518077568,CHETANA'S INSTITUTE OF MANAGEMENT AND RESEARCH,MANAGEMENT,NOT APPLICABLE,POST GRADUATE DIPLOMA,PGDM,210,"SURVEY NO. 341, GOVT. COLONY, BANDRA (E), MUMBAI 400051 MAHARASHTRA",MUMBAI,WESTERN,MUMBAI SUBURBAN,MAHARASHTRA,PRIVATE-SELF FINANCING,,
1-36518077568,CHETANA'S INSTITUTE OF MANAGEMENT AND RESEARCH,MANAGEMENT,NOT APPLICABLE,POST GRADUATE DIPLOMA,PGDM(MARKETING),60,"SURVEY NO. 341, GOVT. COLONY, BANDRA (E), MUMBAI 400051 MAHARASHTRA",MUMBAI,WESTERN,MUMBAI SUBURBAN,MAHARASHTRA,PRIVATE-SELF FINANCING,,
1-36518143500,PVG'S COLLEGE OF ENGINEERING AND TECHNOLOGY AND G.K. PATE (WANI) INSTITUTE OF MANAGEMENT,MANAGEMENT,SAVITRIBAI PHULE PUNE UNIVERSITY,POST GRADUATE,MBA,60,"S.NO.44,VIDYANAGARI,SHIVDARSHAN,PARVATI,PUNE",PUNE,WESTERN,PUNE,MAHARASHTRA,PRIVATE-SELF FINANCING,,
1-36518505244,HUMERA KHAN INSTITUTE OF MANAGEMENT STUDIES & RESEARCH,MANAGEMENT,"MUMBAI UNIVERSITY, MUMBAI",POST GRADUATE,MMS,120,"H.K. CAMPUS, ADJ. MHADA COMPLEX, PRATIKSHA NAGAR, OSHIWARA, JOGESHWARI (WEST), MUMBAI - 400 102.",MUMBAI,WESTERN,MUMBAI SUBURBAN,MAHARASHTRA,PRIVATE-SELF FINANCING,,
1-36519034467,KOHINOOR BUSINESS SCHOOL,MANAGEMENT,"MUMBAI UNIVERSITY, MUMBAI",POST GRADUATE,MMS,120,"KOHINOOR CITY, EDUCATIONAL COMPLEX, KIROL ROAD, KURLA WEST",MUMBAI,WESTERN,MUMBAI CITY,MAHARASHTRA,PRIVATE-SELF FINANCING,,
1-36519067905,"SVKM'S NMIMS SCHOOL OF BUSINESS MANAGEMENT, NAVI MUMBAI",MANAGEMENT,NOT APPLICABLE,POST GRADUATE,MBA,120,"PLOT NO. 2, SECTOR-33, BEHIND RAMSETH THAKUR JUNIOR COLLEGE, KHARGHAR,TALUKA: PANVEL, NAVI MUMBAI",NAVI MUMBAI,WESTERN,RAIGAD,MAHARASHTRA,STATE PRIVATE UNIVERSITY,,
1-36519124681,ADITYA INSTITUTE OF MANAGEMENT - AIMS,MANAGEMENT,"UNIVERSITY OF PUNE, PUNE",POST GRADUATE,MBA,120,"SR.NO.42(PART), NARHE-AMBEGAON, NEAR SPRINGDALE SCHOOL, PUNE.",PUNE,WESTERN,PUNE,MAHARASHTRA,PRIVATE-SELF FINANCING,,
1-36519157359,INTERNATIONAL INSTITUTE OF MANAGEMENT & HUMAN RESOURCE DEVELOPMENT (W),MANAGEMENT,NONE,POST GRADUATE,MBA,180,"SURVEY NO 54 NERE MARUNJE, NEAR HINJEWADI INFOTECH PARK, PUNE",PUNE,WESTERN,PUNE,MAHARASHTRA,PRIVATE-SELF FINANCING,,
1-36519474425,INSTITUTE OF MANAGEMENT & ENTREPRENEURSHIP DEVELOPMENT,MANAGEMENT,"BHARATI VIDYAPEETH UNIVERSITY, PUNE",POST GRADUATE,MBA,180,"BHARATI VIDYAPEETH EDUCATION COMPLEX, PAUD ROAD, ERANDAWANE,",PUNE,WESTERN,PUNE,MAHARASHTRA,PRIVATE-SELF FINANCING,,
1-36519474425,INSTITUTE OF MANAGEMENT & ENTREPRENEURSHIP DEVELOPMENT,MANAGEMENT,"BHARATI VIDYAPEETH UNIVERSITY, PUNE",POST GRADUATE,MBA(HUMAN RESOURCE MANAGEMENT),60,"BHARATI VIDYAPEETH EDUCATION COMPLEX, PAUD ROAD, ERANDAWANE,",PUNE,WESTERN,PUNE,MAHARASHTRA,PRIVATE-SELF FINANCING,,
