AICTE ID,NAME,PROGRAMME,UNIVERSITY,LEVEL OF COURSE,COURSE,INTAKE,ADDRESS,ZONE,CITY,DISTRICT,STATE,INSTITUTE TYPE,,
1-36211608059,SRI RAMAKRISHNA DEGREE COLLEGE,MANAGEMENT,RAYALASEEMA UNIVERSITY,POST GRADUATE,MBA,120,N.G.O.'S COLONY NEAR S.B.I. COLONY NANDYAL,RAYALASEEMA,NANDYAL,KURNOOL,ANDHRA PRADESH,PRIVATE-SELF FINANCING,,
1-36211608059,SRI RAMAKRISHNA DEGREE COLLEGE,MANAGEMENT,RAYALASEEMA UNIVERSITY,POST GRADUATE,MBA(FINANCE),30,N.G.O.'S COLONY NEAR S.B.I. COLONY NANDYAL,RAYALASEEMA,NANDYAL,KURNOOL,ANDHRA PRADESH,PRIVATE-SELF FINANCING,,
1-36596349695,ANNAMACHARYA INSTITUTE OF TECHNOLOGY AND SCIENCES,MANAGEMENT,"ADIKAVI NANNAYA UNIVERSITY, RAJAHMUNDRY",POST GRADUATE,MBA,120,"VENKATAPURAM (VILLAGE), MANGALAM ROAD, KARAKAMBADI(POST), RENIGUNTA(MANDAL),TIRUPATI-517520, CHITTOOR DIST",COASTAL,KAKINADA,CHITTOOR,ANDHRA PRADESH,PRIVATE-SELF FINANCING,,
1-36596538182,SANJEEV INSTITUTE OF PLANNING AND MANAGEMENT,MANAGEMENT,"ACHARYA NAGARJUNA UNIVERSITY, GUNTUR",POST GRADUATE,MBA,60,SANJEEV INSTITUTE OF PLANNING AND MANAGEMENT KAKINADA-GOLLAPALEM ROAD TURANGI ROAD KAKINADA EAST GODAVARI DISTRICT ANDHRA PRADESH,COASTAL,GUNTUR,EAST GODAVARI,ANDHRA PRADESH,PRIVATE-SELF FINANCING,,
1-36250303269,VIJAYAM BUSINESS SCHOOL,MANAGEMENT,"SRI VENKATESWARA UNIVERSITY, TIRUPATI",POST GRADUATE,MASTERS IN BUSINESS ADMINISTRATION (SEM),180,"SUNDARARAJA PURAM(VI),CHITTOOR-PUTHOOR HIGHWAY, PEDDAKALAVA (PO), GANGADHARA NELLORE (MD)",RAYALASEEMA,CHITTOOR,CHITTOOR,ANDHRA PRADESH,PRIVATE-SELF FINANCING,,
1-36595530941,VIGNAN'S NIRULA INSTITUTE OF TECHNOLOGY & SCIENCE FOR WOMEN,MANAGEMENT,"ANDHRA UNIVERSITY, VISAKHAPATNAM",POST GRADUATE,MBA(FINANCE MARKETING AND HUMAN RESOURCE MANAGEMENT),90,"VIGNAN AVENUE PALAKALURU ROAD GUNTUR TEHSIL, GUNTUR - 522 005",COASTAL,VISAKHAPATNAM,GUNTUR,ANDHRA PRADESH,PRIVATE-SELF FINANCING,,
1-36250690729,SRI SATHYA SAI INSTITUTE OF HIGHER LEARNING,MANAGEMENT,NOT APPLICABLE,POST GRADUATE,BUSINESS ADMINISTRATION,60,"SRI SATHYA SAI INSTITUTE OF HIGHER LEARNING DEEMED TO BE UNIVERSITY VIDYAGIRI, PRASANTHI NILAYAM ANANTAPUR DISTRICT ANDHRA PRADESH INDIA PIN 515134",RAYALASEEMA,PRASANTHI NILAYAM,ANANTAPUR,ANDHRA PRADESH,DEEMED TO BE UNIVERSITY(PVT),,
1-36595592853,SANKETIKA VIDYA PARISHAD ENGINEERING COLLEGE,MANAGEMENT,"JAWAHARLAL NEHRU TECHNOLOGICAL UNIVERSITY, ANANTAPUR",POST GRADUATE,MBA,120,"TECHNICAL COMPLEX, BESIDE ACA/VDCA CRICKET STADIUM, POTHINAMALLAYYAPALEM, VISAKHAPATNAM PIN-530041 ANDHRA PRADESH",RAYALASEEMA,TIRUPATI,VISHAKHAPATNAM,ANDHRA PRADESH,PRIVATE-SELF FINANCING,,
1-36261565914,R.K. COLLEGE OF ENGINEERING,MANAGEMENT,"JAWAHARLAL NEHRU TECHNOLOGICAL UNIVERSITY, KAKINADA",POST GRADUATE,MBA,240,"R.S.NO.52,53 ,NAVEPOTAVARAM VILLAGE,KETHANA KONDA,IBRAHIMPATNAM 521456,VIJAYAWADA,A.P.",COASTAL ANDHRA,VIJAYAWADA,KRISHNA,ANDHRA PRADESH,PRIVATE-SELF FINANCING,,
1-36597330864,ST. ANN'S COLLEGE FOR WOMEN,MANAGEMENT,"ACHARYA NAGARJUNA UNIVERSITY, GUNTUR",POST GRADUATE,MBA,120,"ST. ANN'S COLLEGE FOR WOMEN AMARAVATHI ROAD, GORANTLA, GUNTUR - 522035, ANDHRA PRADESH",COASTAL,SINGARAYAKONDA,GUNTUR,ANDHRA PRADESH,PRIVATE-SELF FINANCING,,
1-36266056694,SDGS COLLEGE PG DEPT OF BUSINESS MGT STUDIES,MANAGEMENT,"SRI KRISHNADEVARAYA UNIVERSITY, ANANTAPUR",POST GRADUATE,MBA,120,NANEPPA NAGAR HINDUPUR 515201 ANANTAPUR DIST,RAYALASEEMA,HINDUPUR,ANANTAPUR,ANDHRA PRADESH,PRIVATE-SELF FINANCING,,
1-36599730854,MANDAVA INSTITUTE OF ENGINEERING AND TECHNOLOGY,MANAGEMENT,"JAWAHARLAL NEHRU TECHNOLOGICAL UNIVERSITY, KAKINADA",POST GRADUATE,MBA,60,"VIDYANAGAR, JAGGAYYAPETA, KRISHNA DT - 521175, ANDHRA PRADESH",COASTAL,JAGGAYYAPETA,KRISHNA,ANDHRA PRADESH,PRIVATE-SELF FINANCING,,
1-36267341483,AQJ CENTRE FOR POST GRADUATE STUDIES,MANAGEMENT,"ANDHRA UNIVERSITY, VISAKHAPATNAM",POST GRADUATE,MBA,120,"GUDILOVA, ANANDAPURAM",COASTAL ANDHRA,VISAKHAPATNAM,VISHAKHAPATNAM,ANDHRA PRADESH,PRIVATE-SELF FINANCING,,
1-36938262995,WEST GODAVARI INSTITUTE OF SCIENCE AND ENGINEERING,MANAGEMENT,"JAWAHARLAL NEHRU TECHNOLOGICAL UNIVERSITY, ANANTAPUR",POST GRADUATE,MBA,180,"AVAPADU, PRAKASARAOPALEM(POST), NALLAJERLA (MANDAL), WEST GODAVARI DISTRICT, ANDHRAPRADESH - 534 112",COASTAL,NALLAJERLA,WEST GODAVARI,ANDHRA PRADESH,PRIVATE-SELF FINANCING,,
1-36445329000,"V.K.R., V.N.B. A.G.K. COLLEGE OF ENGINEERING",MANAGEMENT,"JAWAHARLAL NEHRU TECHNOLOGICAL UNIVERSITY, KAKINADA",POST GRADUATE,MBA,60,"ELURU ROAD, GUDIVADA-521301 KRISHNA DISTRICT A.P.",COASTAL ANDHRA,GUDIVADA,KRISHNA,ANDHRA PRADESH,PRIVATE-SELF FINANCING,,
1-36597706135,ABHINAV INSTITUTE OF MANAGEMENT & TECHNOLOGY,MANAGEMENT,"JAWAHARLAL NEHRU TECHNOLOGICAL UNIVERSITY, KAKINADA",POST GRADUATE,MBA,120,"SOMARAJUPALLI, SINGARAYAKONDA PRAKASAM DISTRICT A.P. - 523 101",COASTAL,BALUSUMUDI,PRAKASAM,ANDHRA PRADESH,PRIVATE-SELF FINANCING,,
1-36445367846,NIMRA COLLEGE OF ENGINEERING AND TECHNOLOGY,MANAGEMENT,"JAWAHARLAL NEHRU TECHNOLOGICAL UNIVERSITY, KAKINADA",POST GRADUATE,MASTERS IN BUSINESS ADMINISTRATION,120,"NIMRA NAGAR JUPUD,IBRAHIMPATNAM-521 456,KRISHNA DT., ANDHRA PRADESH",COASTAL ANDHRA,JUPUD,KRISHNA,ANDHRA PRADESH,PRIVATE-SELF FINANCING,,
1-36599573010,DNR COLLEGE OF ENGINEERING & TECHNOLOGY,MANAGEMENT,"JAWAHARLAL NEHRU TECHNOLOGICAL UNIVERSITY, KAKINADA",POST GRADUATE,MBA,120,"DNR COLLEGE OF ENGINEERING & TECHNOLOGY, BALUSUMUDI,",COASTAL,GOOTY,WEST GODAVARI,ANDHRA PRADESH,PRIVATE-SELF FINANCING,,
1-36445371983,SRI BALAJI PG COLLEGE (MBA),MANAGEMENT,"JAWAHARLAL NEHRU TECHNOLOGICAL UNIVERSITY, ANANTAPUR",POST GRADUATE,MBA,180,"SRI BALAJI PG COLLEGE(MBA) RUDRAMPET, ALAMURU (P) ANANTAPUR(DISTRICT) A.P",RAYALASEEMA,ANANTAPUR,ANANTAPUR,ANDHRA PRADESH,PRIVATE-SELF FINANCING,,
1-36592312414,PRR INSTITUTE OF MANAGMENT SCIENCES,MANAGEMENT,"SRI KRISHNADEVARAYA UNIVERSITY, ANANTAPUR",POST GRADUATE,MBA,120,"NEAR MARKET YARD, RAILWAY STATION ROAD, GOOTY",RAYALASEEMA,TIRUPATI,ANANTAPUR,ANDHRA PRADESH,PRIVATE-SELF FINANCING,,
1-36445382794,AVANTHI'S RESEARCH & TECHNOLOGICAL ACADEMY,MANAGEMENT,"JAWAHARLAL NEHRU TECHNOLOGICAL UNIVERSITY, KAKINADA",POST GRADUATE,MBA,120,"AVANTHI'S RESEARCH & TECHNOLOGICAL ACADEMY BASAVAPALEM VILLAGE, BHOGAPURAM MANDALAM, VIZIANAGARAM DISTRICT.",COASTAL ANDHRA,BHOGAPURAM,VIZIANAGARAM,ANDHRA PRADESH,PRIVATE-SELF FINANCING,,
1-36592585610,GATE INSTITUTE OF TECHNOLOGY AND MANAGEMENT SCIENCES,MANAGEMENT,"SRI VENKATESWARA UNIVERSITY, TIRUPATI",POST GRADUATE,MBA,120,"CHIGURAVADA NORTH KANDRIGA (V), RAYALACHERUVU ROAD TIRUPATI RURAL",RAYALASEEMA,PUTTUR,CHITTOOR,ANDHRA PRADESH,PRIVATE-SELF FINANCING,,
1-36446080857,SIR C R REDDY COLLEGE OF ENGINEERING,MANAGEMENT,"JAWAHARLAL NEHRU TECHNOLOGICAL UNIVERSITY, KAKINADA",POST GRADUATE,MBA,60,VATLURU ELURU WEST GODAVARI DISTRICT,COASTAL ANDHRA,ELURU,WEST GODAVARI,ANDHRA PRADESH,PRIVATE-SELF FINANCING,,
1-36591792358,HINDU COLLEGE OF MANAGEMENT,MANAGEMENT,"ACHARYA NAGARJUNA UNIVERSITY, GUNTUR",POST GRADUATE,MBA,120,AMARAVATHI ROAD,COASTAL,RAJAHMUNDRY,GUNTUR,ANDHRA PRADESH,PRIVATE-SELF FINANCING,,
1-36591792358,HINDU COLLEGE OF MANAGEMENT,MANAGEMENT,"ACHARYA NAGARJUNA UNIVERSITY, GUNTUR",POST GRADUATE,MBA (HOSPITAL MANAGEMENT ),60,AMARAVATHI ROAD,COASTAL,RAJAHMUNDRY,GUNTUR,ANDHRA PRADESH,PRIVATE-SELF FINANCING,,
1-36446247828,SIR C V RAMAN COLLEGE OF COMPUTER SCIENCES,MANAGEMENT,"ACHARYA NAGARJUNA UNIVERSITY, GUNTUR",POST GRADUATE,MBA,60,"GREEN FIELDS, ONGOLE ROAD, PODILI, PRAKASAM (DT), ANDHRA PRADESH-523240.",COASTAL ANDHRA,PODILI,PRAKASAM,ANDHRA PRADESH,PRIVATE-SELF FINANCING,,
1-36591793045,RAJIV GANDHI DEGREE COLLEGE,MANAGEMENT,"ANDHRA UNIVERSITY, VISAKHAPATNAM",POST GRADUATE,MBA,120,"D.NO 15-6-3, LUTHERGIRI",RAYALASEEMA,GOOTY,EAST GODAVARI,ANDHRA PRADESH,PRIVATE-SELF FINANCING,,
1-36591793045,RAJIV GANDHI DEGREE COLLEGE,MANAGEMENT,"ANDHRA UNIVERSITY, VISAKHAPATNAM",POST GRADUATE,MBA(RETAIL MANAGEMENT),30,"D.NO 15-6-3, LUTHERGIRI",RAYALASEEMA,GOOTY,EAST GODAVARI,ANDHRA PRADESH,PRIVATE-SELF FINANCING,,
1-36448521389,SRI VENKATESWARA INSTITUTE OF SCIENCE AND TECHNOLOGY,MANAGEMENT,"JAWAHARLAL NEHRU TECHNOLOGICAL UNIVERSITY, ANANTAPUR",POST GRADUATE,MBA,60,"TADIGOTLA (VILLAGE), C.K.DINNE (MANDAL), KADAPA. A.P. 516003",RAYALASEEMA,KADAPA,YSR DISTRICT,ANDHRA PRADESH,PRIVATE-SELF FINANCING,,
1-36592715256,SRI VIDYA INSTITUTE OF MANAGEMENT STUDIES,MANAGEMENT,"SRI VENKATESWARA UNIVERSITY, TIRUPATI",POST GRADUATE,MBA,180,"GOVINDAPALEM,PUTTUR-517583,CHITTOOR DIST ANDHRAPRADESH.",COASTAL,NELLORE,CHITTOOR,ANDHRA PRADESH,PRIVATE-SELF FINANCING,,
1-36450515280,PALIVELA PG COLLEGE,MANAGEMENT,"ADIKAVI NANNAYA UNIVERSITY, RAJAHMUNDRY",POST GRADUATE,MBA,120,8-39-4 AMALAPURAM ROAD PALIVELA KOTHAPETA EAST GODAVARI DISTRICT,COASTAL ANDHRA,PALIVELA,EAST GODAVARI,ANDHRA PRADESH,PRIVATE-SELF FINANCING,,
1-36594798419,PYDAH COLLEGE(P.G. COURSES),MANAGEMENT,"JAWAHARLAL NEHRU TECHNOLOGICAL UNIVERSITY, ANANTAPUR",POST GRADUATE,BUSINESS ADMINISTRATION,240,"GAMBHEERAM, GAMHEERAM VILLAGE, VISAKHAPATNAM-531163",RAYALASEEMA,MADANAPALLE,VISHAKHAPATNAM,ANDHRA PRADESH,PRIVATE-SELF FINANCING,,
1-36451934742,ADITYA INSTITUTE OF TECHNOLOGY AND MANAGEMENT,MANAGEMENT,"JAWAHARLAL NEHRU TECHNOLOGICAL UNIVERSITY, KAKINADA",POST GRADUATE,MBA,60,K.KOTTURU (VILL) TEKKALI - 532 201 SRIKAKULAM (DIST) ANDHRA PRADESH,COASTAL ANDHRA,TEKKALI,SRIKAKULAM,ANDHRA PRADESH,PRIVATE-SELF FINANCING,,
1-36594926194,VISWAM ENGINEERING COLLEGE,MANAGEMENT,"JAWAHARLAL NEHRU TECHNOLOGICAL UNIVERSITY, KAKINADA",POST GRADUATE,MBA,120,"ANGALLU, MADANAPALLE, CHITTOOR DIST. ANDHRAPRADESH.",COASTAL,GUNTUR,CHITTOOR,ANDHRA PRADESH,PRIVATE-SELF FINANCING,,
1-36452464120,ANNAMACHARYA PG COLLEGE OF COMPUTER STUDIES,MANAGEMENT,"JAWAHARLAL NEHRU TECHNOLOGICAL UNIVERSITY, ANANTAPUR",POST GRADUATE,MBA,90,NEW BOYANAPALLI THALLAPAKA PANCHAYATH RAJAMPET MANDAL YSR DISTRICT,RAYALASEEMA,RAJAMPET,YSR DISTRICT,ANDHRA PRADESH,PRIVATE-SELF FINANCING,,
1-36592715956,RAOS INSTITUTE OF MANAGEMENT STUDIES,MANAGEMENT,NOT APPLICABLE,POST GRADUATE DIPLOMA,PGDM,180,"CHEMUDUGUNTA (PO), VENKATACHALAM (M), NELLORE(DT) - 524320.",COASTAL,VISAKHAPATNAM,NELLORE,ANDHRA PRADESH,PRIVATE-SELF FINANCING,,
1-36455497013,KALLAM HARANADHAREDDY INSTITUTE OF TECHNOLOGY,MANAGEMENT,"JAWAHARLAL NEHRU TECHNOLOGICAL UNIVERSITY, KAKINADA",POST GRADUATE,MBA,60,"BEHIND KALLAM SPINNING MILLS LIMITED N.H.5,CHOWDAVARAM",COASTAL ANDHRA,CHOWDAVARAM,GUNTUR,ANDHRA PRADESH,PRIVATE-SELF FINANCING,,
1-36593578818,INTEGRAL INSTITUTE OF ADVANCED MANAGEMENT (IIAM),MANAGEMENT,"ANDHRA UNIVERSITY, VISAKHAPATNAM",POST GRADUATE,MBA,180,"EDUCATIONAL COMPLEX, PLOT NO.10, MUVVALAVANIPALEM, VISAKHAPATNAM - 530 017",COASTAL,VISAKHAPATNAM,VISHAKHAPATNAM,ANDHRA PRADESH,PRIVATE-SELF FINANCING,,
1-36455537825,MUTTAMSETTY VENKATA NARAYANA INSTITUTE OF MANAGEMENT STUDIES & RESEARCH,MANAGEMENT,"JAWAHARLAL NEHRU TECHNOLOGICAL UNIVERSITY, KAKINADA",POST GRADUATE,MBA,240,"VEGAVARAM VILLAGE JANGAREDDYGUDEM MANDAL WEST GODAVARI DISTRICT ANDHRA PRADESH; NH-5, ELURU BYPASS ROAD, TANGILLAMUDI, ELURU. ANDHRA PRADESH",COASTAL ANDHRA,ELURU,WEST GODAVARI,ANDHRA PRADESH,PRIVATE-SELF FINANCING,,
1-36951302354,PRABHATH INSTITUTE OF BUSINESS MANAGEMENT,MANAGEMENT,"JAWAHARLAL NEHRU TECHNOLOGICAL UNIVERSITY, ANANTAPUR",POST GRADUATE,MBA,120,PARNAPALLI(V) NANDYAL KURNOOL(DT) A.P,RAYALASEEMA,NANDYAL,KURNOOL,ANDHRA PRADESH,PRIVATE-SELF FINANCING,,
1-36455582562,DCRM PG COLLEGE (MBA),MANAGEMENT,"ACHARYA NAGARJUNA UNIVERSITY, GUNTUR",POST GRADUATE,MBA,120,GANGAVARAM ROAD INKOLLU - 523167 PRAKASAM (DIST.) ANDHRA PRADESH.,COASTAL ANDHRA,INKOLLU,PRAKASAM,ANDHRA PRADESH,PRIVATE-SELF FINANCING,,
1-36951568781,SREE VYSHNAVI M.B.A.COLLEGE,MANAGEMENT,"SRI KRISHNADEVARAYA UNIVERSITY, ANANTAPUR",POST GRADUATE,MASTERS IN BUSINESS ADMINISTRATION,120,"D.NO.1/564 JANDA STREET, GOOTY VILLAGE & MANDAL, ANANTAPUR DISTRICT.",RAYALASEEMA,GOOTY,ANANTAPUR,ANDHRA PRADESH,PRIVATE-SELF FINANCING,,
1-36455627004,NOVA PG COLLEGE(MBA),MANAGEMENT,"JAWAHARLAL NEHRU TECHNOLOGICAL UNIVERSITY, KAKINADA",POST GRADUATE,MBA,240,T.V.RELAY STATION ROAD JUPUDI VILLAGE IBRAHIMPATNAM MANDAL KRISHNA DISTRICT ANDHRA PRADESH PIN:521456,COASTAL ANDHRA,JUPUDI,KRISHNA,ANDHRA PRADESH,PRIVATE-SELF FINANCING,,
1-36951082683,KSRM COLLEGE OF MANAGEMENT STUDIES,MANAGEMENT,"JAWAHARLAL NEHRU TECHNOLOGICAL UNIVERSITY, ANANTAPUR",POST GRADUATE,MBA,240,YERRAMASUPALLI VILLAGE C.K. DINNE MANDAL CUDDAPAH - 516003 ANDHRA PRADESH,RAYALASEEMA,CUDDAPAH,YSR DISTRICT,ANDHRA PRADESH,PRIVATE-SELF FINANCING,,
1-36456143743,DVR&DR.HS MIC COLLEGE OF TECHNOLOGY,MANAGEMENT,"JAWAHARLAL NEHRU TECHNOLOGICAL UNIVERSITY, KAKINADA",POST GRADUATE,MBA,60,DVR & DR HS MIC COLLEGE OF TECHNOLOGY KANCHIKACHERLA-521 180 KRISHNA DISTRICT ANDHA PRADESH,COASTAL ANDHRA,KANCHIKACHERLA,KRISHNA,ANDHRA PRADESH,PRIVATE-SELF FINANCING,,
1-36951142957,SAI RAJESWARI INSTITUTE OF TECHNOLOGY,MANAGEMENT,"JAWAHARLAL NEHRU TECHNOLOGICAL UNIVERSITY, ANANTAPUR",POST GRADUATE,MBA(GENERAL MANAGEMENT),60,"BALAJI NAGAR, TALLAMAPURAM ROAD",RAYALASEEMA,BALAJI NAGAR,YSR DISTRICT,ANDHRA PRADESH,PRIVATE-SELF FINANCING,,
1-36456356460,SRI SAI COLLEGE OF IT & MANAGEMENT,MANAGEMENT,"JAWAHARLAL NEHRU TECHNOLOGICAL UNIVERSITY, ANANTAPUR",POST GRADUATE,MBA,240,BUDDAYAPALL KADAPA,RAYALASEEMA,KADAPA,YSR DISTRICT,ANDHRA PRADESH,PRIVATE-SELF FINANCING,,
1-36951664182,PRABHAT INSTITUTE OF COMPUTER SCIENCE,MANAGEMENT,"JAWAHARLAL NEHRU TECHNOLOGICAL UNIVERSITY, ANANTAPUR",POST GRADUATE,MBA,120,"PARNAPALLI,NANDYAL.KURNOOL(DT),A.P",RAYALASEEMA,NANDYAL,KURNOOL,ANDHRA PRADESH,PRIVATE-SELF FINANCING,,
1-36457363841,DNR COLLEGE,MANAGEMENT,"ADIKAVI NANNAYA UNIVERSITY, RAJAHMUNDRY",POST GRADUATE,MBA,120,"SECRETARY & CORRESPONDENT, DNR COLLEGE ASSOCIATION, BALUSUMUDI, BHIMAVARAM-534202, WEST GODAVARI DISTRICT, ANDHRA PRADESH",COASTAL ANDHRA,BHIMAVARAM,WEST GODAVARI,ANDHRA PRADESH,PRIVATE-SELF FINANCING,,
1-36952132788,SRI VENKATESA PERUMAL COLLEGE OF ENGINEERING & TECHNOLOGY,MANAGEMENT,"JAWAHARLAL NEHRU TECHNOLOGICAL UNIVERSITY, ANANTAPUR",POST GRADUATE,MBA,180,"CHINNARAJA KUPPAM, KN ROAD, PUTTUR ? 517 583, CHITTOOR (DT), A.P.",RAYALASEEMA,PUTTUR,CHITTOOR,ANDHRA PRADESH,PRIVATE-SELF FINANCING,,
1-36458385733,S.V.ARTS & SCIENCE COLLEGE,MANAGEMENT,"VIKRAM SIMHAPURI UNIVERSITY, NELLORE",POST GRADUATE,MBA,168,"DIVIPALEM VILLAGE, WEST GUDUR, GUDUR - 524102, SPSR NELLORE DIST.",COASTAL ANDHRA,GUDUR,NELLORE,ANDHRA PRADESH,PRIVATE-SELF FINANCING,,
1-36958971979,MJR INSTITUTE OF BUSINESS MANAGEMENT,MANAGEMENT,"JAWAHARLAL NEHRU TECHNOLOGICAL UNIVERSITY, ANANTAPUR",POST GRADUATE,MBA,180,DIGUVAPOKULAVARIPALLI PULICHERLA CHITTOOR,RAYALASEEMA,PULICHERLA,CHITTOOR,ANDHRA PRADESH,PRIVATE-SELF FINANCING,,
1-36459425156,SRI Y. N. COLLEGE,MANAGEMENT,"ADIKAVI NANNAYA UNIVERSITY, RAJAHMUNDRY",POST GRADUATE,MBA,120,SRI Y.N.COLLEGE COLLEGE STREET NARSAPUR - 534275 WEST GODAVARI DISTRICT ANDHRA PRADESH,COASTAL ANDHRA,NARSAPUR,WEST GODAVARI,ANDHRA PRADESH,PRIVATE-SELF FINANCING,,
1-36952012323,BHARATH COLLEGE OF ENGINEERING AND TECHNOLOGY FOR WOMEN,MANAGEMENT,"JAWAHARLAL NEHRU TECHNOLOGICAL UNIVERSITY, ANANTAPUR",POST GRADUATE,MBA,54,"BUGGALATIPALLI,C.K.DINNA MANDAL,RAYACHOTY ROAD,KADAPA,ANDHRA PRADESH,INDIA",RAYALASEEMA,KADAPA,YSR DISTRICT,ANDHRA PRADESH,PRIVATE-SELF FINANCING,,
1-36461202514,ALWAR SCHOOL OF BUSINESS AND COMPUTERS,MANAGEMENT,NOT APPLICABLE,POST GRADUATE DIPLOMA,PGDM,180,"HIMACHAL NAGAR, MULAGADA, GAJUWAKA, VISAKHAPATNAM - 530026",COASTAL ANDHRA,GAJUWAKA,VISHAKHAPATNAM,ANDHRA PRADESH,PRIVATE-SELF FINANCING,,
1-36952072981,SRI SAI INSTITUTE OF TECHNOLOGY AND SCIENCE,MANAGEMENT,"JAWAHARLAL NEHRU TECHNOLOGICAL UNIVERSITY, ANANTAPUR",POST GRADUATE,MBA,120,"2/714-18, GOLLAPALLI (V) RAYACHOTI- 516 270",RAYALASEEMA,GOLLAPALLI,YSR DISTRICT,ANDHRA PRADESH,PRIVATE-SELF FINANCING,,
1-36461246981,P.V.K.K. INSTITUTE OF TECHNOLOGY,MANAGEMENT,"JAWAHARLAL NEHRU TECHNOLOGICAL UNIVERSITY, ANANTAPUR",POST GRADUATE,MBA,180,"RUDRAMPETA, SANAPA ROAD,ANANTAPUR,A P.",RAYALASEEMA,ANANTAPUR,ANANTAPUR,ANDHRA PRADESH,PRIVATE-SELF FINANCING,,
1-36943696670,ELURU COLLEGE OF ENGINEERING & TECHNOLOGY,MANAGEMENT,"DR.B.R.AMBEDKAR UNIVERSITY,SRIKAKULAM",POST GRADUATE,MBA,60,"DUGGIRALA (V), PEDAVEGI(M), WEST GODAVARI DISTRICT",COASTAL,PEDAVEGI,WEST GODAVARI,ANDHRA PRADESH,PRIVATE-SELF FINANCING,,
1-36461389279,KBN COLLEGE PG CENTER,MANAGEMENT,"KRISHNA UNIVERSITY , MACHLLIPATANAM",POST GRADUATE,MBA,120,KOTHAPET VIJAYAWADA KRISHNA-520001,COASTAL ANDHRA,VIJAYAWADA,KRISHNA,ANDHRA PRADESH,PRIVATE-SELF FINANCING,,
1-36945311532,GAYATRI COLLEGE FOR PG COURSES,MANAGEMENT,"ACHARYA NAGARJUNA UNIVERSITY, GUNTUR",POST GRADUATE,MBA,120,MUNASABPETA SRIKAKULAM - 532401 ANDHRA PRADESH,COASTAL,SRIKAKULAM,SRIKAKULAM,ANDHRA PRADESH,PRIVATE-SELF FINANCING,,
1-36462185978,RAMACHANDRA COLLEGE OF ENGINEERING,MANAGEMENT,"JAWAHARLAL NEHRU TECHNOLOGICAL UNIVERSITY, KAKINADA",POST GRADUATE,MBA,120,"NH-5 BYPASS ROAD, VATLURU (V), ELURU-534007, WEST GODAVARI DT., ANDHRA PRADESH.",COASTAL ANDHRA,ELURU,WEST GODAVARI,ANDHRA PRADESH,PRIVATE-SELF FINANCING,,
1-36938953221,SIDDARTHA EDUCATIONAL ACADEMY GROUP OF INSTITUTIONS,MANAGEMENT,"ANDHRA UNIVERSITY, VISAKHAPATNAM",POST GRADUATE,MBA,60,"CHINTAGUNTA VILLAGE, NEAR C. GOLLAPALLI, TIRUPATI (RURAL) - 517 505 CHITTOOR DIST A.P.",RAYALASEEMA,TIRUPATI,CHITTOOR,ANDHRA PRADESH,PRIVATE-SELF FINANCING,,
1-36462439635,UNIVERSAL COLLEGE OF ENGINEERING AND TECHNOLOGY,MANAGEMENT,"JAWAHARLAL NEHRU TECHNOLOGICAL UNIVERSITY, KAKINADA",POST GRADUATE,MBA,60,"DOKIPARRU (VILLAGE) MEDIKONDUR (MANDAL), GUNTUR-522 438.",COASTAL ANDHRA,MEDIKONDUR,GUNTUR,ANDHRA PRADESH,PRIVATE-SELF FINANCING,,
1-36939565348,YALAMARTY INSTITUTE OF COMPUTER SCIENCES,MANAGEMENT,"JAWAHARLAL NEHRU TECHNOLOGICAL UNIVERSITY, KAKINADA",POST GRADUATE,MBA,60,YALAMARTY NAGAR TARLUWADA VILLAGE ANANDAPURAM MANDAL VISAKHAPATNAM-530052,COASTAL,VISAKHAPATNAM,VISHAKHAPATNAM,ANDHRA PRADESH,PRIVATE-SELF FINANCING,,
1-36462837116,ESWAR COLLEGE OF ENGINEERING,MANAGEMENT,"JAWAHARLAL NEHRU TECHNOLOGICAL UNIVERSITY, KAKINADA",POST GRADUATE,MBA,60,"ESWAR COLLEGE OF ENGINEERING KESANUPALLY(V), NARASARAOPET(M), GUNTUR(DIST)-522601, ANDHRA PRADESH, INDIA",COASTAL ANDHRA,NARASARAOPET,GUNTUR,ANDHRA PRADESH,PRIVATE-SELF FINANCING,,
1-36945701334,NAGARJUNA INSTITUTE OF MANAGEMENT STUDIES,MANAGEMENT,"JAWAHARLAL NEHRU TECHNOLOGICAL UNIVERSITY, KAKINADA",POST GRADUATE,MBA,240,NAGARJUNA INSTITUTE OF MANAGEMENT STUDIES CHEKURAPADU NGPADU MANDAL PRAKASAM DT ANDRA PRADESH.,COASTAL,CHEKURAPADU,PRAKASAM,ANDHRA PRADESH,PRIVATE-SELF FINANCING,,
1-36463312199,ST. VINCENT DE PAUL COLLEGE,MANAGEMENT,"ADIKAVI NANNAYA UNIVERSITY, RAJAHMUNDRY",POST GRADUATE,MBA,60,DUGGIRALA,COASTAL ANDHRA,DUGGIRALA,WEST GODAVARI,ANDHRA PRADESH,PRIVATE-SELF FINANCING,,
1-36950669867,JNTUA SCHOOL OF MANAGEMENT STUDIES,MANAGEMENT,"JAWAHARLAL NEHRU TECHNOLOGICAL UNIVERSITY, ANANTAPUR",POST GRADUATE,MBA(FIN TECH),60,SIR M VISWESWARAIAH ROAD,RAYALASEEMA,ANANTAPUR,ANANTAPUR,ANDHRA PRADESH,GOVERNMENT,,
1-36950669867,JNTUA SCHOOL OF MANAGEMENT STUDIES,MANAGEMENT,"JAWAHARLAL NEHRU TECHNOLOGICAL UNIVERSITY, ANANTAPUR",POST GRADUATE,MBA(GENERAL MANAGEMENT),60,SIR M VISWESWARAIAH ROAD,RAYALASEEMA,ANANTAPUR,ANANTAPUR,ANDHRA PRADESH,GOVERNMENT,,
1-36465592750,PRIYADARSHINI COLLEGE OF ENGINEERING & TECHNOLOGY,MANAGEMENT,"JAWAHARLAL NEHRU TECHNOLOGICAL UNIVERSITY, ANANTAPUR",POST GRADUATE,MBA,60,KANUPARTHIPADU NELLORE - 524004 SPSR NELLORE(DIST.),COASTAL ANDHRA,NELLORE,NELLORE,ANDHRA PRADESH,PRIVATE-SELF FINANCING,,
1-36950924301,RAJIV GANDHI INSTITUTE OF MANAGEMENT & SCIENCE,MANAGEMENT,"JAWAHARLAL NEHRU TECHNOLOGICAL UNIVERSITY, KAKINADA",POST GRADUATE,MBA,540,"124, THIMMAPURAM VILLAGE, ACTHMPETA, KAKINADA - 533 005.",COASTAL,KAKINADA,EAST GODAVARI,ANDHRA PRADESH,PRIVATE-SELF FINANCING,,
1-36466327012,VISAKHA INSTITUTE FOR PROFES SIONAL STUDIES,MANAGEMENT,"ANDHRA UNIVERSITY, VISAKHAPATNAM",POST GRADUATE,MBA,60,"KAPULUPPADA, VISAKAPATNAM URBAN AGGLOMERATION VISAKHAPATNAM",COASTAL ANDHRA,KAPULUPPADA,VISHAKHAPATNAM,ANDHRA PRADESH,PRIVATE-SELF FINANCING,,
1-36946004362,PRIYADARSHINI INSTITUTE OF TECHNOLOGY & SCIENCE,MANAGEMENT,"JAWAHARLAL NEHRU TECHNOLOGICAL UNIVERSITY, KAKINADA",POST GRADUATE,MBA,180,"CHINTALAPUDI, DUGGIRALA MANDAL, NEAR TENALI, GUNTUR DIST - ANDHRA PRADESH - 522 306",COASTAL,CHINTALAPUDI,GUNTUR,ANDHRA PRADESH,PRIVATE-SELF FINANCING,,
1-36466368384,GONNA INSTITUTE OF INFORMATION TECHNOLOGY AND SCIENCES,MANAGEMENT,"JAWAHARLAL NEHRU TECHNOLOGICAL UNIVERSITY, KAKINADA",POST GRADUATE,MBA(GENERAL MANAGEMENT),240,"WARD NO:-56, GONNAVANI PALEM, AGANAMPUDI, VISAKHAPATNAM.",COASTAL ANDHRA,AGANAMPUDI,VISHAKHAPATNAM,ANDHRA PRADESH,PRIVATE-SELF FINANCING,,
1-36946159229,BABA INSTITUTE OF TECHNOLOGY AND SCIENCES,MANAGEMENT,"JAWAHARLAL NEHRU TECHNOLOGICAL UNIVERSITY, ANANTAPUR",POST GRADUATE,MBA (BUSINESS ANALYTICS),60,"P M PALEM, MADHURAWADA",COASTAL,VISAKHAPATNAM,VISHAKHAPATNAM,ANDHRA PRADESH,PRIVATE-SELF FINANCING,,
1-36466432067,GAYATRI VIDYA PARISHAD COLLEGE FOR DEGREE AND PG COURSES,MANAGEMENT,"ANDHRA UNIVERSITY, VISAKHAPATNAM",POST GRADUATE,MBA (BUSINESS ANALYTICS),60,"YENDADA VILLAGE, RUSHIKONDA,VISAKHAPATNAM - 530 045",COASTAL ANDHRA,RUSHIKONDA,VISHAKHAPATNAM,ANDHRA PRADESH,PRIVATE-SELF FINANCING,,
1-36591648167,JAGAN'S INSTITUTE OF MANAGEMENT AND COMPUTER STUDIES,MANAGEMENT,"VIKRAM SIMHAPURI UNIVERSITY, NELLORE",POST GRADUATE,MBA,240,"S.CHAAVAN INSTITUTE OF COMPUTER APPLICATIONS JANGALAKANDRIGA(VI), MUTHUKUR(MD) SPSR NELLORE (DT) ANDHRA PRADESH PIN: 524346",COASTAL,GUNTUR,NELLORE,ANDHRA PRADESH,PRIVATE-SELF FINANCING,,
1-36591648167,JAGAN'S INSTITUTE OF MANAGEMENT AND COMPUTER STUDIES,MANAGEMENT,"VIKRAM SIMHAPURI UNIVERSITY, NELLORE",POST GRADUATE,MBA (HEALTH CARE AND HOSPITAL MANAGEMENT),60,"S.CHAAVAN INSTITUTE OF COMPUTER APPLICATIONS JANGALAKANDRIGA(VI), MUTHUKUR(MD) SPSR NELLORE (DT) ANDHRA PRADESH PIN: 524346",COASTAL,GUNTUR,NELLORE,ANDHRA PRADESH,PRIVATE-SELF FINANCING,,
1-36467607648,VEERAVALLI VIDY SUNDAR P.G. COLLEGE,MANAGEMENT,"ANDHRA UNIVERSITY, VISAKHAPATNAM",POST GRADUATE,MBA,180,BURUGUPUDI KORUKONDA MANDAL RAJAHMUNDRY EAST GODAVARI DT.,COASTAL ANDHRA,BURUGUPUDI,EAST GODAVARI,ANDHRA PRADESH,PRIVATE-SELF FINANCING,,
1-36565873603,BIT INSTITUTE OF TECHNOLOGY,MANAGEMENT,"ANDHRA UNIVERSITY, VISAKHAPATNAM",POST GRADUATE,MBA,180,"S.NO. 284/1, MALGUR (V), BEEREPALLI (P), H.S. MANDIR (S.O), HINDUPUR",RAYALASEEMA,HINDUPUR,ANANTAPUR,ANDHRA PRADESH,PRIVATE-SELF FINANCING,,
1-36468306152,ADDANKI INSTITUTE OF MANAGEMENT AND SCIENCES,MANAGEMENT,"JAWAHARLAL NEHRU TECHNOLOGICAL UNIVERSITY, KAKINADA",POST GRADUATE,MBA,120,ADDANKI INSTITUTE OF MANAGEMENT AND SCIENCES NEAR SINGARA KONDA NRT ROAD NORTH ADDANKI ADDANKI MANDAL PRAKASAM DISTRICT 523201,COASTAL ANDHRA,ADDANKI,PRAKASAM,ANDHRA PRADESH,PRIVATE-SELF FINANCING,,
1-36566192365,SAMATA COLLEGE,MANAGEMENT,"ACHARYA NAGARJUNA UNIVERSITY, GUNTUR",POST GRADUATE,MBA,60,"SECTOR : 10, M.V.P.COLONY, VISAKHAPATNAM - 530 017",COASTAL ANDHRA,VISAKHAPATNAM,VISHAKHAPATNAM,ANDHRA PRADESH,PRIVATE-SELF FINANCING,,
1-36468413669,GLOBAL INSTITUTE OF MANAGEMENT AND TECHNOLOGY,MANAGEMENT,"JAWAHARLAL NEHRU TECHNOLOGICAL UNIVERSITY, KAKINADA",POST GRADUATE,MBA,60,"KOYYURU ROAD, BOMMULURU, HANUMAN JUNCTION, KRISHNA DISTRICT - 521 105, ANDHRA PRADESH.",COASTAL ANDHRA,HANUMAN JUNCTION,KRISHNA,ANDHRA PRADESH,PRIVATE-SELF FINANCING,,
1-36565539169,ALLAGADDA INSTITUTE OF MANAGEMENT SCIENC,MANAGEMENT,"SRI KRISHNADEVARAYA UNIVERSITY, ANANTAPUR",POST GRADUATE,MBA,60,"KANDUKURIMETTA, ALLAGADDA, KURNOOL(DIST), ANDHRA PRADESH",RAYALASEEMA,ALLAGADDA,KURNOOL,ANDHRA PRADESH,PRIVATE-SELF FINANCING,,
1-36468796867,AVANTHI INSTITUTE OF ENGINEERING & TECHNOLOGY,MANAGEMENT,"JAWAHARLAL NEHRU TECHNOLOGICAL UNIVERSITY, KAKINADA",POST GRADUATE,MBA,120,"TAMARAM VILLAGE, MAKAVARAPALEM MANDAL, NARSIPATNAM REVENUE DIVISION, VISAKHAPATNAM DIST.",COASTAL ANDHRA,MAKAVARAPALEM,VISHAKHAPATNAM,ANDHRA PRADESH,PRIVATE-SELF FINANCING,,
1-36565826941,HAINDAVI PG COLLEGE (MBA),MANAGEMENT,"JAWAHARLAL NEHRU TECHNOLOGICAL UNIVERSITY, ANANTAPUR",POST GRADUATE,MBA,60,"PUTTAPARTHY ROAD, DHARMAVARAM - 515671, ANANTAPUR DISTRICT, A.P.",RAYALASEEMA,DHARMAVARAM,ANANTAPUR,ANDHRA PRADESH,PRIVATE-SELF FINANCING,,
1-36469042105,ROYAL SCHOOL OF INFORMATION & MANAGEMENT SCIENCES,MANAGEMENT,"SRI VENKATESWARA UNIVERSITY, TIRUPATI",POST GRADUATE,MBA,150,"AGARALA,OPP.CHANDRAGIRI FORT,TIRUPATI-CHITTOOR HIGHWAY,CHANDRAGIRI(M)",RAYALASEEMA,TIRUPATI,CHITTOOR,ANDHRA PRADESH,PRIVATE-SELF FINANCING,,
1-36566193027,VASAVI MCA&MBA COLLEGE,MANAGEMENT,"JAWAHARLAL NEHRU TECHNOLOGICAL UNIVERSITY, KAKINADA",POST GRADUATE,MBA,60,KANDULA PURAM CUMBUM PRAKASAM (DIST)-523333,COASTAL ANDHRA,CUMBUM,PRAKASAM,ANDHRA PRADESH,PRIVATE-SELF FINANCING,,
1-36469366812,SRI SARATHI INSTITUTE OF ENGINEERING & TECHNOOLOGY,MANAGEMENT,"JAWAHARLAL NEHRU TECHNOLOGICAL UNIVERSITY, KAKINADA",POST GRADUATE,MBA(GENERAL MANAGEMENT),120,"DR. NO:2-78-10A, NEAR MDO OFFICE, NUZVID - 521201 KRISHNA DIST., ANDHRA PRADESH.",COASTAL ANDHRA,NUZVID,KRISHNA,ANDHRA PRADESH,PRIVATE-SELF FINANCING,,
1-36566628007,CENTRE FOR MANAGEMENT & TECHNOLOGY (CMT),MANAGEMENT,NOT APPLICABLE,POST GRADUATE DIPLOMA,PGDM,40,"P.M.PALEM, MADHURAWADA, VISAKHAPATANAM-530041.",COASTAL ANDHRA,VISAKHAPATNAM,VISHAKHAPATNAM,ANDHRA PRADESH,PRIVATE-SELF FINANCING,,
1-36470066961,SAPTHAGIRI INSTITUTE OF MANAGEMENT,MANAGEMENT,"SRI KRISHNADEVARAYA UNIVERSITY, ANANTAPUR",POST GRADUATE,MBA,180,"D.NO: 20-9-1/7, NIMKAMPALLI ROAD, HINDUPUR - 515201, ANANTAPUR(DIST), A.P",RAYALASEEMA,HINDUPUR,ANANTAPUR,ANDHRA PRADESH,PRIVATE-SELF FINANCING,,
1-36567092918,SREE VENKATESWARA COLLEGE OF ENGINEERING,MANAGEMENT,"JAWAHARLAL NEHRU TECHNOLOGICAL UNIVERSITY, ANANTAPUR",POST GRADUATE,MBA,120,"GOLDEN NAGAR, NH-5-NORTH RAJUPALEM BYPASS ROAD.",COASTAL ANDHRA,NORTH RAJUPALEM,NELLORE,ANDHRA PRADESH,PRIVATE-SELF FINANCING,,
1-36470108929,SREE KONASEEMA BHANOJI RAMARS COLLEGE,MANAGEMENT,"ADIKAVI NANNAYA UNIVERSITY, RAJAHMUNDRY",POST GRADUATE,MBA,60,S.K.B.R.COLLEGE AMALAPURAM EAST GODAVARI DISTRICT ANDHRA PRADESH PIN-533201,COASTAL ANDHRA,AMALAPURAM,EAST GODAVARI,ANDHRA PRADESH,PRIVATE-SELF FINANCING,,
